TIME_PERIOD,PUBLICATION_MONTH,ORDER,PROVIDER_CODE,PROVIDER_NAME,SHMI_VALUE,SHMI_BANDING,PO_LL,PO_UL,OD_LL,OD_UL,OBSERVED,EXPECTED,ELECTIVE_DEPTH,NONELECTIVE_DEPTH,PALLIATIVE_DEATHS,PALLIATIVE_CODE
MAR21_FEB22,JUL_22,39,RWP,WORCESTERSHIRE ACUTE HOSPITALS NHS TRUST,1.0476,2,0.9401,1.0626,0.8984,1.1131,2685,2560,5.0753,6.365,34,1.9
MAR21_FEB22,JUL_22,39,RRF,"WRIGHTINGTON, WIGAN AND LEIGH NHS FOUNDATION TRUST",1.0803,2,0.9189,1.086,0.8932,1.1196,1490,1380,6.1045,6.8039,52,3
MAR21_FEB22,JUL_22,39,RLQ,WYE VALLEY NHS TRUST,1.1299,1,0.9073,1.0992,0.8897,1.1239,1185,1050,4.1532,5.1941,27,1.7
MAR21_FEB22,JUL_22,39,RA4,YEOVIL DISTRICT HOSPITAL NHS FOUNDATION TRUST,0.9555,2,0.9105,1.0955,0.8907,1.1227,1075,1125,4.2126,5.3183,66,3.5
MAR21_FEB22,JUL_22,39,RCB,YORK AND SCARBOROUGH TEACHING HOSPITALS NHS FOUNDATION TRUST,0.961,2,0.9442,1.0581,0.8992,1.112,2850,2965,4.6294,5.3659,28,1.4
APR21_MAR22,AUG_22,40,RCF,AIREDALE NHS FOUNDATION TRUST,0.9505,2,0.9046,1.1022,0.8866,1.1279,940,990,5.1209,4.8742,22,1.1
APR21_MAR22,AUG_22,40,RTK,ASHFORD AND ST PETER'S HOSPITALS NHS FOUNDATION TRUST,0.899,2,0.9244,1.0798,0.8922,1.1209,1435,1595,4.8744,5.8337,48,2.3
APR21_MAR22,AUG_22,40,RF4,"BARKING, HAVERING AND REDBRIDGE UNIVERSITY HOSPITALS NHS TRUST",0.8535,3,0.9401,1.0625,0.8958,1.1163,2190,2565,6.064,6.6179,43,2.1
APR21_MAR22,AUG_22,40,RFF,BARNSLEY HOSPITAL NHS FOUNDATION TRUST,1.0222,2,0.918,1.087,0.8905,1.123,1380,1350,6.9154,7.7023,29,1.6
APR21_MAR22,AUG_22,40,R1H,BARTS HEALTH NHS TRUST,0.9568,2,0.945,1.0572,0.8968,1.1151,2920,3055,7.8209,6.6424,34,1.3
APR21_MAR22,AUG_22,40,RC9,BEDFORDSHIRE HOSPITALS NHS FOUNDATION TRUST,1.0718,2,0.9383,1.0644,0.8954,1.1168,2590,2420,5.3072,5.3954,38,1.4
APR21_MAR22,AUG_22,40,RXL,BLACKPOOL TEACHING HOSPITALS NHS FOUNDATION TRUST,1.0842,2,0.9299,1.0737,0.8935,1.1192,2020,1860,6.9605,6.477,38,2.1
APR21_MAR22,AUG_22,40,RMC,BOLTON NHS FOUNDATION TRUST,1.084,2,0.9202,1.0845,0.8911,1.1222,1550,1430,5.7711,5.184,37,1.6
APR21_MAR22,AUG_22,40,RAE,BRADFORD TEACHING HOSPITALS NHS FOUNDATION TRUST,1.0307,2,0.9218,1.0827,0.8915,1.1217,1535,1485,5.6215,4.2677,31,1
APR21_MAR22,AUG_22,40,RXQ,BUCKINGHAMSHIRE HEALTHCARE NHS TRUST,0.9742,2,0.9238,1.0805,0.892,1.1211,1530,1570,5.8091,4.4136,64,2.8
APR21_MAR22,AUG_22,40,RWY,CALDERDALE AND HUDDERSFIELD NHS FOUNDATION TRUST,1.0467,2,0.9328,1.0706,0.8942,1.1183,2120,2025,4.946,5.8782,33,1.7
APR21_MAR22,AUG_22,40,RGT,CAMBRIDGE UNIVERSITY HOSPITALS NHS FOUNDATION TRUST,0.9107,2,0.9354,1.0676,0.8948,1.1176,2005,2200,4.0197,5.9801,45,2.7
APR21_MAR22,AUG_22,40,RQM,CHELSEA AND WESTMINSTER HOSPITAL NHS FOUNDATION TRUST,0.6964,3,0.9297,1.074,0.8935,1.1192,1285,1850,4.5664,5.2184,43,1.3
APR21_MAR22,AUG_22,40,RFS,CHESTERFIELD ROYAL HOSPITAL NHS FOUNDATION TRUST,0.9579,2,0.926,1.078,0.8926,1.1203,1600,1670,5.2017,6.1516,22,1.3
APR21_MAR22,AUG_22,40,RJR,COUNTESS OF CHESTER HOSPITAL NHS FOUNDATION TRUST,0.9591,2,0.9153,1.0901,0.8897,1.124,1210,1265,2.8174,4.5112,34,1.3
APR21_MAR22,AUG_22,40,RXP,COUNTY DURHAM AND DARLINGTON NHS FOUNDATION TRUST,1.0885,2,0.9411,1.0615,0.896,1.1161,2885,2650,5.7747,5.2515,56,3
APR21_MAR22,AUG_22,40,RJ6,CROYDON HEALTH SERVICES NHS TRUST,1.023,2,0.9042,1.1027,0.8864,1.1281,1005,980,3.9725,5.8339,55,3.2
APR21_MAR22,AUG_22,40,RN7,DARTFORD AND GRAVESHAM NHS TRUST,1.0619,2,0.9167,1.0885,0.8901,1.1235,1390,1305,3.9551,4.2597,56,2.1
APR21_MAR22,AUG_22,40,RP5,DONCASTER AND BASSETLAW TEACHING HOSPITALS NHS FOUNDATION TRUST,1.1545,1,0.9323,1.0711,0.8941,1.1185,2305,2000,4.1341,5.2063,44,2.4
APR21_MAR22,AUG_22,40,RBD,DORSET COUNTY HOSPITAL NHS FOUNDATION TRUST,1.1328,1,0.9046,1.1023,0.8865,1.128,1120,990,5.3874,6.3845,45,2.5
APR21_MAR22,AUG_22,40,RWH,EAST AND NORTH HERTFORDSHIRE NHS TRUST,0.8982,2,0.9331,1.0702,0.8943,1.1182,1840,2045,4.6409,5.685,41,2.1
APR21_MAR22,AUG_22,40,RJN,EAST CHESHIRE NHS TRUST,1.1482,1,0.8833,1.1271,0.8794,1.1371,750,650,6,7.0505,26,2.2
APR21_MAR22,AUG_22,40,RVV,EAST KENT HOSPITALS UNIVERSITY NHS FOUNDATION TRUST,0.9981,2,0.9467,1.0554,0.8971,1.1147,3250,3255,5.9148,6.7681,42,1.9
APR21_MAR22,AUG_22,40,RXR,EAST LANCASHIRE HOSPITALS NHS TRUST,1.0493,2,0.9363,1.0667,0.895,1.1173,2375,2265,4.9522,4.5743,32,1.5
APR21_MAR22,AUG_22,40,RDE,EAST SUFFOLK AND NORTH ESSEX NHS FOUNDATION TRUST,1.0782,2,0.9495,1.0524,0.8976,1.1141,3910,3625,5.5891,6.1939,34,2.3
APR21_MAR22,AUG_22,40,RXC,EAST SUSSEX HEALTHCARE NHS TRUST,0.9833,2,0.9382,1.0645,0.8954,1.1168,2370,2410,5.657,6.2995,43,2.5
APR21_MAR22,AUG_22,40,RVR,EPSOM AND ST HELIER UNIVERSITY HOSPITALS NHS TRUST,1.1251,1,0.9178,1.0872,0.8904,1.1231,1510,1345,6.327,6.8517,46,2.6
APR21_MAR22,AUG_22,40,RDU,FRIMLEY HEALTH NHS FOUNDATION TRUST,0.9927,2,0.9458,1.0564,0.8969,1.1149,3120,3145,4.3067,5.0614,43,2.1
APR21_MAR22,AUG_22,40,RR7,GATESHEAD HEALTH NHS FOUNDATION TRUST,1.0112,2,0.9167,1.0884,0.8901,1.1235,1320,1305,5.374,6.2965,38,2.1
APR21_MAR22,AUG_22,40,RLT,GEORGE ELIOT HOSPITAL NHS TRUST,1.1148,2,0.8998,1.1078,0.8851,1.1299,995,895,4.5024,5.1795,34,1.9
APR21_MAR22,AUG_22,40,RTE,GLOUCESTERSHIRE HOSPITALS NHS FOUNDATION TRUST,1.0926,2,0.9389,1.0639,0.8955,1.1166,2690,2460,4.7737,4.6076,40,1.7
APR21_MAR22,AUG_22,40,RN3,GREAT WESTERN HOSPITALS NHS FOUNDATION TRUST,0.9256,2,0.9274,1.0765,0.8929,1.1199,1605,1735,4.964,4.461,44,2.3
APR21_MAR22,AUG_22,40,RJ1,GUY'S AND ST THOMAS' NHS FOUNDATION TRUST,0.7136,3,0.9311,1.0724,0.8938,1.1188,1375,1930,6.8141,6.0722,54,1.8
APR21_MAR22,AUG_22,40,RN5,HAMPSHIRE HOSPITALS NHS FOUNDATION TRUST,0.8753,3,0.9366,1.0663,0.8951,1.1172,2000,2285,4.9255,6.0438,56,2.9
APR21_MAR22,AUG_22,40,RCD,HARROGATE AND DISTRICT NHS FOUNDATION TRUST,1.0915,2,0.8974,1.1105,0.8843,1.1309,930,850,4.5017,4.7347,39,2
APR21_MAR22,AUG_22,40,RQX,HOMERTON HEALTHCARE NHS FOUNDATION TRUST,0.8512,3,0.8779,1.1335,0.8775,1.1396,505,595,6.0754,6.8679,43,0.9
APR21_MAR22,AUG_22,40,RWA,HULL UNIVERSITY TEACHING HOSPITALS NHS TRUST,1.1459,1,0.941,1.0615,0.896,1.1161,3035,2650,6.7236,6.1528,34,2.6
APR21_MAR22,AUG_22,40,RYJ,IMPERIAL COLLEGE HEALTHCARE NHS TRUST,0.723,3,0.9384,1.0643,0.8954,1.1168,1755,2425,7.1785,7.0429,61,2.3
APR21_MAR22,AUG_22,40,R1F,ISLE OF WIGHT NHS TRUST,0.9308,2,0.8971,1.1109,0.8842,1.131,785,845,5.4498,6.5736,63,3.5
APR21_MAR22,AUG_22,40,RGP,JAMES PAGET UNIVERSITY HOSPITALS NHS FOUNDATION TRUST,1.0732,2,0.9174,1.0876,0.8903,1.1232,1430,1330,6.1261,6.7601,37,2.8
APR21_MAR22,AUG_22,40,RNQ,KETTERING GENERAL HOSPITAL NHS FOUNDATION TRUST,1.1224,2,0.9185,1.0864,0.8906,1.1228,1535,1365,4.1693,5.2582,50,2.5
APR21_MAR22,AUG_22,40,RJZ,KING'S COLLEGE HOSPITAL NHS FOUNDATION TRUST,1.0165,2,0.9407,1.0619,0.8959,1.1162,2660,2615,6.7659,6.8009,47,2.2
APR21_MAR22,AUG_22,40,RAX,KINGSTON HOSPITAL NHS FOUNDATION TRUST,0.7791,3,0.9151,1.0903,0.8897,1.124,980,1255,5.2245,4.1668,51,1.2
APR21_MAR22,AUG_22,40,RXN,LANCASHIRE TEACHING HOSPITALS NHS FOUNDATION TRUST,0.977,2,0.934,1.0692,0.8945,1.118,2055,2105,5.8163,6.2648,52,2.4
APR21_MAR22,AUG_22,40,RR8,LEEDS TEACHING HOSPITALS NHS TRUST,1.1054,2,0.9466,1.0555,0.8971,1.1147,3585,3245,4.9054,6.2455,34,2
APR21_MAR22,AUG_22,40,RJ2,LEWISHAM AND GREENWICH NHS TRUST,0.9529,2,0.9339,1.0694,0.8944,1.118,1995,2095,3.7339,4.356,34,1.3
APR21_MAR22,AUG_22,40,REM,LIVERPOOL UNIVERSITY HOSPITALS NHS FOUNDATION TRUST,1.0029,2,0.9474,1.0546,0.8972,1.1145,3355,3345,5.3928,6.5963,53,3.2
APR21_MAR22,AUG_22,40,R1K,LONDON NORTH WEST UNIVERSITY HEALTHCARE NHS TRUST,0.7803,3,0.9422,1.0602,0.8962,1.1158,2155,2760,4.9844,5.3192,30,1.2
APR21_MAR22,AUG_22,40,RWF,MAIDSTONE AND TUNBRIDGE WELLS NHS TRUST,0.9858,2,0.9357,1.0673,0.8949,1.1175,2190,2220,4.7521,4.9666,31,1.2
APR21_MAR22,AUG_22,40,R0A,MANCHESTER UNIVERSITY NHS FOUNDATION TRUST,0.956,2,0.9506,1.0512,0.8978,1.1138,3630,3800,5.9216,5.5829,46,2.3
APR21_MAR22,AUG_22,40,RPA,MEDWAY NHS FOUNDATION TRUST,1.0485,2,0.9223,1.0822,0.8916,1.1216,1580,1505,5.7111,5.2245,47,2
APR21_MAR22,AUG_22,40,RAJ,MID AND SOUTH ESSEX NHS FOUNDATION TRUST,1.0771,2,0.9573,1.044,0.8989,1.1125,5495,5105,5.0339,5.1346,29,1.6
APR21_MAR22,AUG_22,40,RBT,MID CHESHIRE HOSPITALS NHS FOUNDATION TRUST,0.9526,2,0.9218,1.0828,0.8915,1.1217,1415,1485,5.9058,5.6212,30,1.5
APR21_MAR22,AUG_22,40,RXF,MID YORKSHIRE HOSPITALS NHS TRUST,1.0422,2,0.9379,1.0649,0.8953,1.1169,2485,2385,5.815,6.1533,34,1.6
APR21_MAR22,AUG_22,40,RD8,MILTON KEYNES UNIVERSITY HOSPITAL NHS FOUNDATION TRUST,1.0826,2,0.9099,1.0961,0.8882,1.1259,1205,1115,4.835,3.8874,53,2.2
APR21_MAR22,AUG_22,40,RM1,NORFOLK AND NORWICH UNIVERSITY HOSPITALS NHS FOUNDATION TRUST,1.1942,1,0.9405,1.062,0.8959,1.1162,3110,2605,4.9711,5.1147,56,3.6
APR21_MAR22,AUG_22,40,RVJ,NORTH BRISTOL NHS TRUST,0.976,2,0.9353,1.0678,0.8948,1.1176,2140,2190,5.948,5.4226,44,1.6
APR21_MAR22,AUG_22,40,RNN,NORTH CUMBRIA INTEGRATED CARE NHS FOUNDATION TRUST,1.1153,2,0.9265,1.0775,0.8927,1.1202,1885,1690,4.2428,5.1374,37,2.5
APR21_MAR22,AUG_22,40,RAP,NORTH MIDDLESEX UNIVERSITY HOSPITAL NHS TRUST,0.9192,2,0.9119,1.0938,0.8888,1.1252,1070,1165,4.8657,5.4869,43,2.2
APR21_MAR22,AUG_22,40,RVW,NORTH TEES AND HARTLEPOOL NHS FOUNDATION TRUST,0.9589,2,0.9273,1.0766,0.8929,1.12,1660,1730,6.4898,6.7072,41,2.2
APR21_MAR22,AUG_22,40,RGN,NORTH WEST ANGLIA NHS FOUNDATION TRUST,1.1239,1,0.9373,1.0656,0.8952,1.1171,2630,2340,3.8789,4.6577,44,2.6
APR21_MAR22,AUG_22,40,RNS,NORTHAMPTON GENERAL HOSPITAL NHS TRUST,0.9171,2,0.929,1.0747,0.8933,1.1194,1660,1810,4.3622,4.6935,48,1.5
APR21_MAR22,AUG_22,40,RM3,NORTHERN CARE ALLIANCE NHS FOUNDATION TRUST,1.0465,2,0.9503,1.0515,0.8977,1.1139,3920,3745,5.9972,6.1119,43,2.5
APR21_MAR22,AUG_22,40,RJL,NORTHERN LINCOLNSHIRE AND GOOLE NHS FOUNDATION TRUST,1.0268,2,0.9333,1.07,0.8943,1.1182,2115,2060,5.8055,5.6204,22,1.5
APR21_MAR22,AUG_22,40,RTF,NORTHUMBRIA HEALTHCARE NHS FOUNDATION TRUST,0.989,2,0.9419,1.0606,0.8962,1.1159,2695,2725,4.6779,4.655,41,2
APR21_MAR22,AUG_22,40,RX1,NOTTINGHAM UNIVERSITY HOSPITALS NHS TRUST,1.0063,2,0.9512,1.0506,0.8979,1.1137,3910,3890,7.3064,6.876,41,1.8
APR21_MAR22,AUG_22,40,RTH,OXFORD UNIVERSITY HOSPITALS NHS FOUNDATION TRUST,0.9398,2,0.947,1.0551,0.8971,1.1146,3090,3290,7.3293,7.2674,54,2.4
APR21_MAR22,AUG_22,40,RHU,PORTSMOUTH HOSPITALS UNIVERSITY NATIONAL HEALTH SERVICE TRUST,0.9715,2,0.9438,1.0585,0.8965,1.1154,2835,2920,5.8698,6.1814,40,1.8
APR21_MAR22,AUG_22,40,RHW,ROYAL BERKSHIRE NHS FOUNDATION TRUST,1.0231,2,0.93,1.0736,0.8935,1.1191,1910,1865,3.6015,4.5049,59,2.6
APR21_MAR22,AUG_22,40,REF,ROYAL CORNWALL HOSPITALS NHS TRUST,1.0324,2,0.9316,1.0718,0.8939,1.1187,2025,1960,4.0375,4.991,32,1.8
APR21_MAR22,AUG_22,40,RH8,ROYAL DEVON UNIVERSITY HEALTHCARE NHS FOUNDATION TRUST,0.9627,2,0.9456,1.0566,0.8969,1.115,3000,3115,5.0646,5.946,39,1.9
APR21_MAR22,AUG_22,40,RAL,ROYAL FREE LONDON NHS FOUNDATION TRUST,0.8363,3,0.9405,1.0621,0.8959,1.1162,2175,2600,6.0656,5.7705,39,1.6
APR21_MAR22,AUG_22,40,RA2,ROYAL SURREY COUNTY HOSPITAL NHS FOUNDATION TRUST,0.7097,3,0.9227,1.0817,0.8917,1.1214,1080,1525,7.0273,7.0366,62,2.5
APR21_MAR22,AUG_22,40,RD1,ROYAL UNITED HOSPITALS BATH NHS FOUNDATION TRUST,1.0338,2,0.9272,1.0767,0.8929,1.12,1780,1720,4.3739,5.1533,32,1.6
APR21_MAR22,AUG_22,40,RNZ,SALISBURY NHS FOUNDATION TRUST,1.1134,2,0.9025,1.1046,0.8859,1.1288,1055,945,4.7088,4.5513,50,2.3
APR21_MAR22,AUG_22,40,RXK,SANDWELL AND WEST BIRMINGHAM HOSPITALS NHS TRUST,1.0398,2,0.9241,1.0801,0.8921,1.121,1645,1585,4.8977,5.696,32,1.5
APR21_MAR22,AUG_22,40,RHQ,SHEFFIELD TEACHING HOSPITALS NHS FOUNDATION TRUST,0.9764,2,0.9454,1.0568,0.8969,1.115,3025,3100,5.5775,5.4109,40,2.1
APR21_MAR22,AUG_22,40,RK5,SHERWOOD FOREST HOSPITALS NHS FOUNDATION TRUST,0.9917,2,0.9306,1.073,0.8937,1.119,1885,1900,5.5194,5.7095,11,0.6
APR21_MAR22,AUG_22,40,RH5,SOMERSET NHS FOUNDATION TRUST,1.0329,2,0.9291,1.0746,0.8933,1.1194,1880,1820,5.3833,5.4092,20,1.4
APR21_MAR22,AUG_22,40,RTR,SOUTH TEES HOSPITALS NHS FOUNDATION TRUST,1.1135,2,0.9355,1.0675,0.8948,1.1176,2455,2205,4.5876,5.2376,44,2
APR21_MAR22,AUG_22,40,R0B,SOUTH TYNESIDE AND SUNDERLAND NHS FOUNDATION TRUST,1.1457,1,0.9412,1.0613,0.896,1.116,3055,2665,5.4253,7.293,28,2.1
APR21_MAR22,AUG_22,40,RJC,SOUTH WARWICKSHIRE NHS FOUNDATION TRUST,0.9992,2,0.9146,1.0909,0.8895,1.1242,1240,1240,4.6582,5.1502,28,1.2
APR21_MAR22,AUG_22,40,RVY,SOUTHPORT AND ORMSKIRK HOSPITAL NHS TRUST,1.0257,2,0.9128,1.0929,0.889,1.1248,1220,1190,4.3459,5.6353,45,3.4
APR21_MAR22,AUG_22,40,RJ7,ST GEORGE'S UNIVERSITY HOSPITALS NHS FOUNDATION TRUST,0.9109,2,0.9264,1.0776,0.8927,1.1203,1535,1685,5.4344,6.3029,56,2.4
APR21_MAR22,AUG_22,40,RBN,ST HELENS AND KNOWSLEY TEACHING HOSPITALS NHS TRUST,1.0679,2,0.9338,1.0694,0.8944,1.118,2235,2090,6.1682,5.7126,46,2
APR21_MAR22,AUG_22,40,RWJ,STOCKPORT NHS FOUNDATION TRUST,0.9846,2,0.9251,1.079,0.8924,1.1206,1600,1625,4.8859,5.7316,24,1.2
APR21_MAR22,AUG_22,40,RTP,SURREY AND SUSSEX HEALTHCARE NHS TRUST,1.0181,2,0.9275,1.0763,0.8929,1.1199,1770,1740,6.389,7.3954,49,2.8
APR21_MAR22,AUG_22,40,RMP,TAMESIDE AND GLOSSOP INTEGRATED CARE NHS FOUNDATION TRUST,1.0939,2,0.9086,1.0977,0.8878,1.1264,1180,1080,6.5731,6.3182,22,1.1
APR21_MAR22,AUG_22,40,RNA,THE DUDLEY GROUP NHS FOUNDATION TRUST,1.1073,2,0.9296,1.0741,0.8934,1.1193,2045,1845,5.612,5.7605,23,1.3
APR21_MAR22,AUG_22,40,RAS,THE HILLINGDON HOSPITALS NHS FOUNDATION TRUST,1.0328,2,0.8987,1.109,0.8847,1.1303,905,875,3.4198,3.6745,49,1.8
APR21_MAR22,AUG_22,40,RTD,THE NEWCASTLE UPON TYNE HOSPITALS NHS FOUNDATION TRUST,0.918,2,0.939,1.0637,0.8956,1.1166,2270,2470,6.3284,5.3826,42,1.9
APR21_MAR22,AUG_22,40,RQW,THE PRINCESS ALEXANDRA HOSPITAL NHS TRUST,0.9929,2,0.9175,1.0875,0.8903,1.1232,1325,1335,4.7682,4.8837,40,1.4
APR21_MAR22,AUG_22,40,RCX,"THE QUEEN ELIZABETH HOSPITAL, KING'S LYNN, NHS FOUNDATION TRUST",1.0403,2,0.9204,1.0843,0.8911,1.1222,1490,1435,3.6154,4.2128,20,1
APR21_MAR22,AUG_22,40,RFR,THE ROTHERHAM NHS FOUNDATION TRUST,1.0643,2,0.9128,1.0929,0.889,1.1249,1265,1190,7.9637,7.1511,40,1.7
APR21_MAR22,AUG_22,40,RL4,THE ROYAL WOLVERHAMPTON NHS TRUST,0.9734,2,0.9384,1.0644,0.8954,1.1168,2355,2420,8.3708,5.3721,41,1.7
APR21_MAR22,AUG_22,40,RXW,THE SHREWSBURY AND TELFORD HOSPITAL NHS TRUST,1.0228,2,0.9376,1.0653,0.8953,1.117,2410,2360,5.2749,5.6302,32,1.8
APR21_MAR22,AUG_22,40,RA9,TORBAY AND SOUTH DEVON NHS FOUNDATION TRUST,1.1017,2,0.9235,1.0809,0.8919,1.1212,1715,1555,5.9197,5.0184,38,2.2
APR21_MAR22,AUG_22,40,RWD,UNITED LINCOLNSHIRE HOSPITALS NHS TRUST,1.0668,2,0.9435,1.0588,0.8965,1.1155,3085,2890,5.8313,7.0844,35,2.4
APR21_MAR22,AUG_22,40,RRV,UNIVERSITY COLLEGE LONDON HOSPITALS NHS FOUNDATION TRUST,0.8171,3,0.9124,1.0933,0.8889,1.125,965,1180,7.5257,7.2578,66,2.8
APR21_MAR22,AUG_22,40,RHM,UNIVERSITY HOSPITAL SOUTHAMPTON NHS FOUNDATION TRUST,0.8213,3,0.9448,1.0574,0.8967,1.1152,2485,3030,6.9898,8.7177,31,1.8
APR21_MAR22,AUG_22,40,RRK,UNIVERSITY HOSPITALS BIRMINGHAM NHS FOUNDATION TRUST,0.993,2,0.961,1.0401,0.8994,1.1118,6095,6140,6.4006,6.6528,24,1.3
APR21_MAR22,AUG_22,40,RA7,UNIVERSITY HOSPITALS BRISTOL AND WESTON NHS FOUNDATION TRUST,0.9878,2,0.9343,1.0689,0.8945,1.1179,2100,2125,5.2829,5.2705,42,1.8
APR21_MAR22,AUG_22,40,RKB,UNIVERSITY HOSPITALS COVENTRY AND WARWICKSHIRE NHS TRUST,1.1046,2,0.9373,1.0656,0.8952,1.1171,2585,2340,4.051,4.2699,34,1.3
APR21_MAR22,AUG_22,40,R0D,UNIVERSITY HOSPITALS DORSET NHS FOUNDATION TRUST,0.9018,2,0.9493,1.0526,0.8976,1.1141,3245,3600,3.9171,5.3507,44,2.5
APR21_MAR22,AUG_22,40,RTG,UNIVERSITY HOSPITALS OF DERBY AND BURTON NHS FOUNDATION TRUST,0.9535,2,0.9532,1.0483,0.8982,1.1133,4045,4245,5.5011,5.5493,32,1.6
APR21_MAR22,AUG_22,40,RWE,UNIVERSITY HOSPITALS OF LEICESTER NHS TRUST,1.0442,2,0.9491,1.0528,0.8975,1.1142,3725,3565,5.0106,5.1741,39,2
APR21_MAR22,AUG_22,40,RTX,UNIVERSITY HOSPITALS OF MORECAMBE BAY NHS FOUNDATION TRUST,0.9986,2,0.9277,1.0762,0.893,1.1198,1745,1745,6.2977,6.2884,34,2.1
APR21_MAR22,AUG_22,40,RJE,UNIVERSITY HOSPITALS OF NORTH MIDLANDS NHS TRUST,1.0212,2,0.9492,1.0526,0.8976,1.1141,3670,3590,6.7574,6.1957,55,2.4
APR21_MAR22,AUG_22,40,RK9,UNIVERSITY HOSPITALS PLYMOUTH NHS TRUST,1.1345,1,0.9332,1.0701,0.8943,1.1182,2330,2055,6.5217,5.1831,37,1.8
APR21_MAR22,AUG_22,40,RYR,UNIVERSITY HOSPITALS SUSSEX NHS FOUNDATION TRUST,1.0548,2,0.9545,1.047,0.8985,1.113,4740,4495,5.1924,6.4091,46,2.7
APR21_MAR22,AUG_22,40,RBK,WALSALL HEALTHCARE NHS TRUST,1.0597,2,0.9172,1.0879,0.8902,1.1233,1400,1325,6.6677,5.2585,36,1.5
APR21_MAR22,AUG_22,40,RWW,WARRINGTON AND HALTON TEACHING HOSPITALS NHS FOUNDATION TRUST,0.9519,2,0.9137,1.0918,0.8893,1.1245,1155,1215,7.8042,8.295,53,2.6
APR21_MAR22,AUG_22,40,RWG,WEST HERTFORDSHIRE TEACHING HOSPITALS NHS TRUST,0.9558,2,0.9312,1.0723,0.8938,1.1188,1845,1930,5.0226,5.873,47,2
APR21_MAR22,AUG_22,40,RGR,WEST SUFFOLK NHS FOUNDATION TRUST,0.8689,3,0.9222,1.0822,0.8916,1.1216,1310,1505,5.2159,6.6106,45,2.6
APR21_MAR22,AUG_22,40,RKE,WHITTINGTON HEALTH NHS TRUST,0.9068,2,0.8739,1.1383,0.876,1.1416,505,555,3.618,5.2524,43,2
APR21_MAR22,AUG_22,40,RBL,WIRRAL UNIVERSITY TEACHING HOSPITAL NHS FOUNDATION TRUST,1.0632,2,0.9283,1.0755,0.8931,1.1197,1890,1775,5.4872,6.3145,61,3.1
APR21_MAR22,AUG_22,40,RWP,WORCESTERSHIRE ACUTE HOSPITALS NHS TRUST,1.046,2,0.9393,1.0634,0.8956,1.1165,2610,2495,5.1226,6.3103,35,1.8
APR21_MAR22,AUG_22,40,RRF,"WRIGHTINGTON, WIGAN AND LEIGH NHS FOUNDATION TRUST",1.1195,2,0.9179,1.0872,0.8904,1.123,1505,1345,6.1212,6.7923,51,3
APR21_MAR22,AUG_22,40,RLQ,WYE VALLEY NHS TRUST,1.1043,2,0.907,1.0995,0.8873,1.127,1150,1040,4.1481,5.1535,27,1.7
APR21_MAR22,AUG_22,40,RA4,YEOVIL DISTRICT HOSPITAL NHS FOUNDATION TRUST,0.9712,2,0.9091,1.0971,0.8879,1.1262,1060,1090,4.2445,5.266,64,3.4
APR21_MAR22,AUG_22,40,RCB,YORK AND SCARBOROUGH TEACHING HOSPITALS NHS FOUNDATION TRUST,0.9644,2,0.9434,1.0589,0.8965,1.1155,2780,2885,4.6337,5.3197,28,1.4
MAY21_APR22,SEP_22,41,RCF,AIREDALE NHS FOUNDATION TRUST,0.9421,2,0.9049,1.1019,0.8872,1.1271,935,995,5.0881,4.8289,21,1
MAY21_APR22,SEP_22,41,RTK,ASHFORD AND ST PETER'S HOSPITALS NHS FOUNDATION TRUST,0.914,2,0.9245,1.0797,0.8928,1.1201,1460,1600,4.8506,5.7708,48,2.2
MAY21_APR22,SEP_22,41,RF4,"BARKING, HAVERING AND REDBRIDGE UNIVERSITY HOSPITALS NHS TRUST",0.8438,3,0.9403,1.0623,0.8965,1.1155,2185,2585,6.0566,6.5411,43,2
MAY21_APR22,SEP_22,41,RFF,BARNSLEY HOSPITAL NHS FOUNDATION TRUST,1.0081,2,0.918,1.087,0.891,1.1223,1360,1350,6.9267,7.6416,28,1.5
MAY21_APR22,SEP_22,41,R1H,BARTS HEALTH NHS TRUST,0.9334,2,0.9449,1.0573,0.8974,1.1144,2840,3045,7.827,6.6753,33,1.3
MAY21_APR22,SEP_22,41,RC9,BEDFORDSHIRE HOSPITALS NHS FOUNDATION TRUST,1.0739,2,0.9381,1.0647,0.896,1.1161,2580,2405,5.2931,5.373,38,1.4
MAY21_APR22,SEP_22,41,RXL,BLACKPOOL TEACHING HOSPITALS NHS FOUNDATION TRUST,1.0918,2,0.9296,1.074,0.8941,1.1185,2015,1845,6.9323,6.3734,38,2.1
MAY21_APR22,SEP_22,41,RMC,BOLTON NHS FOUNDATION TRUST,1.0747,2,0.92,1.0847,0.8916,1.1216,1525,1420,5.7801,5.134,36,1.6
MAY21_APR22,SEP_22,41,RAE,BRADFORD TEACHING HOSPITALS NHS FOUNDATION TRUST,1.0286,2,0.9214,1.0832,0.892,1.1211,1515,1475,5.5623,4.223,30,1
MAY21_APR22,SEP_22,41,RXQ,BUCKINGHAMSHIRE HEALTHCARE NHS TRUST,0.9723,2,0.9236,1.0807,0.8925,1.1204,1520,1560,5.7537,4.3267,63,2.7
MAY21_APR22,SEP_22,41,RWY,CALDERDALE AND HUDDERSFIELD NHS FOUNDATION TRUST,1.0477,2,0.9325,1.0708,0.8947,1.1177,2105,2010,5.0213,5.8927,33,1.7
MAY21_APR22,SEP_22,41,RGT,CAMBRIDGE UNIVERSITY HOSPITALS NHS FOUNDATION TRUST,0.9058,2,0.9354,1.0677,0.8954,1.1168,1990,2200,4.0185,5.94,46,2.7
MAY21_APR22,SEP_22,41,RQM,CHELSEA AND WESTMINSTER HOSPITAL NHS FOUNDATION TRUST,0.7072,3,0.93,1.0736,0.8941,1.1184,1320,1865,4.6684,5.1992,42,1.3
MAY21_APR22,SEP_22,41,RFS,CHESTERFIELD ROYAL HOSPITAL NHS FOUNDATION TRUST,0.9593,2,0.9262,1.0778,0.8932,1.1195,1610,1675,5.2093,6.0299,22,1.3
MAY21_APR22,SEP_22,41,RJR,COUNTESS OF CHESTER HOSPITAL NHS FOUNDATION TRUST,0.9625,2,0.9146,1.0908,0.8901,1.1235,1195,1240,2.997,4.5482,35,1.4
MAY21_APR22,SEP_22,41,RXP,COUNTY DURHAM AND DARLINGTON NHS FOUNDATION TRUST,1.0958,2,0.9408,1.0617,0.8966,1.1154,2885,2630,5.7276,5.1966,57,3
MAY21_APR22,SEP_22,41,RJ6,CROYDON HEALTH SERVICES NHS TRUST,1.0122,2,0.904,1.1029,0.8869,1.1275,990,975,3.9878,5.7752,55,3.2
MAY21_APR22,SEP_22,41,RN7,DARTFORD AND GRAVESHAM NHS TRUST,1.0496,2,0.9166,1.0885,0.8907,1.1227,1370,1305,4.084,4.2797,56,2.1
MAY21_APR22,SEP_22,41,RP5,DONCASTER AND BASSETLAW TEACHING HOSPITALS NHS FOUNDATION TRUST,1.1758,1,0.9315,1.072,0.8945,1.118,2290,1950,4.13,5.1493,45,2.4
MAY21_APR22,SEP_22,41,RBD,DORSET COUNTY HOSPITAL NHS FOUNDATION TRUST,1.1391,1,0.904,1.1029,0.8869,1.1275,1115,975,5.4096,6.3372,44,2.5
MAY21_APR22,SEP_22,41,RWH,EAST AND NORTH HERTFORDSHIRE NHS TRUST,0.8998,2,0.9325,1.0709,0.8947,1.1177,1810,2010,4.6523,5.6839,41,2.1
MAY21_APR22,SEP_22,41,RJN,EAST CHESHIRE NHS TRUST,1.1813,1,0.8813,1.1295,0.8792,1.1374,745,630,5.9598,6.9778,26,2.3
MAY21_APR22,SEP_22,41,RVV,EAST KENT HOSPITALS UNIVERSITY NHS FOUNDATION TRUST,0.9897,2,0.9463,1.0558,0.8976,1.114,3175,3205,5.9164,6.7404,42,1.9
MAY21_APR22,SEP_22,41,RXR,EAST LANCASHIRE HOSPITALS NHS TRUST,1.0461,2,0.9363,1.0666,0.8956,1.1166,2370,2265,4.9502,4.5697,31,1.5
MAY21_APR22,SEP_22,41,RDE,EAST SUFFOLK AND NORTH ESSEX NHS FOUNDATION TRUST,1.07,2,0.9493,1.0526,0.8982,1.1133,3855,3605,5.6097,6.1679,34,2.3
MAY21_APR22,SEP_22,41,RXC,EAST SUSSEX HEALTHCARE NHS TRUST,0.9868,2,0.9383,1.0645,0.896,1.116,2380,2415,5.6087,6.3098,43,2.5
MAY21_APR22,SEP_22,41,RVR,EPSOM AND ST HELIER UNIVERSITY HOSPITALS NHS TRUST,1.1322,1,0.9173,1.0878,0.8908,1.1225,1500,1325,6.3871,6.824,46,2.5
MAY21_APR22,SEP_22,41,RDU,FRIMLEY HEALTH NHS FOUNDATION TRUST,0.9911,2,0.9456,1.0566,0.8975,1.1142,3095,3120,4.3022,5.0249,42,2
MAY21_APR22,SEP_22,41,RR7,GATESHEAD HEALTH NHS FOUNDATION TRUST,0.9927,2,0.917,1.0882,0.8908,1.1226,1305,1315,5.2608,6.1439,39,2.1
MAY21_APR22,SEP_22,41,RLT,GEORGE ELIOT HOSPITAL NHS TRUST,1.0909,2,0.8997,1.1079,0.8856,1.1292,970,890,4.5965,5.2412,34,1.8
MAY21_APR22,SEP_22,41,RTE,GLOUCESTERSHIRE HOSPITALS NHS FOUNDATION TRUST,1.1009,2,0.9383,1.0645,0.896,1.116,2655,2410,4.6683,4.5603,40,1.7
MAY21_APR22,SEP_22,41,RN3,GREAT WESTERN HOSPITALS NHS FOUNDATION TRUST,0.9458,2,0.9268,1.0771,0.8934,1.1194,1610,1705,4.8045,4.3647,44,2.3
MAY21_APR22,SEP_22,41,RJ1,GUY'S AND ST THOMAS' NHS FOUNDATION TRUST,0.7167,3,0.9313,1.0722,0.8944,1.118,1390,1940,6.7894,6.0461,54,1.7
MAY21_APR22,SEP_22,41,RN5,HAMPSHIRE HOSPITALS NHS FOUNDATION TRUST,0.8745,3,0.9366,1.0664,0.8957,1.1165,1995,2285,4.934,6.0212,56,3
MAY21_APR22,SEP_22,41,RCD,HARROGATE AND DISTRICT NHS FOUNDATION TRUST,1.0945,2,0.898,1.1099,0.885,1.1299,940,860,4.4805,4.6899,38,2
MAY21_APR22,SEP_22,41,RQX,HOMERTON HEALTHCARE NHS FOUNDATION TRUST,0.844,3,0.879,1.1322,0.8784,1.1385,510,605,6.0028,6.8924,40,0.9
MAY21_APR22,SEP_22,41,RWA,HULL UNIVERSITY TEACHING HOSPITALS NHS TRUST,1.1441,1,0.9408,1.0618,0.8966,1.1154,3005,2625,6.6893,6.1253,33,2.5
MAY21_APR22,SEP_22,41,RYJ,IMPERIAL COLLEGE HEALTHCARE NHS TRUST,0.7387,3,0.9385,1.0643,0.8961,1.116,1795,2430,7.1393,7.0152,61,2.3
MAY21_APR22,SEP_22,41,R1F,ISLE OF WIGHT NHS TRUST,0.9227,2,0.8974,1.1105,0.8848,1.1302,785,850,5.4825,6.5888,63,3.5
MAY21_APR22,SEP_22,41,RGP,JAMES PAGET UNIVERSITY HOSPITALS NHS FOUNDATION TRUST,1.0815,2,0.9172,1.0879,0.8908,1.1226,1430,1325,6.1695,6.7521,36,2.8
MAY21_APR22,SEP_22,41,RNQ,KETTERING GENERAL HOSPITAL NHS FOUNDATION TRUST,1.1218,2,0.9186,1.0863,0.8912,1.1221,1540,1370,4.1771,5.2207,49,2.5
MAY21_APR22,SEP_22,41,RJZ,KING'S COLLEGE HOSPITAL NHS FOUNDATION TRUST,1.0028,2,0.9407,1.0619,0.8965,1.1154,2625,2615,6.843,6.8195,47,2.2
MAY21_APR22,SEP_22,41,RAX,KINGSTON HOSPITAL NHS FOUNDATION TRUST,0.7859,3,0.9152,1.0902,0.8903,1.1233,990,1260,5.214,4.198,52,1.2
MAY21_APR22,SEP_22,41,RXN,LANCASHIRE TEACHING HOSPITALS NHS FOUNDATION TRUST,0.9954,2,0.9338,1.0694,0.895,1.1173,2085,2095,5.7428,6.2892,53,2.4
MAY21_APR22,SEP_22,41,RR8,LEEDS TEACHING HOSPITALS NHS TRUST,1.1124,2,0.9465,1.0556,0.8977,1.114,3595,3230,4.8598,6.1575,34,2.1
MAY21_APR22,SEP_22,41,RJ2,LEWISHAM AND GREENWICH NHS TRUST,0.9472,2,0.9339,1.0693,0.8951,1.1172,1990,2100,3.7495,4.3453,35,1.3
MAY21_APR22,SEP_22,41,REM,LIVERPOOL UNIVERSITY HOSPITALS NHS FOUNDATION TRUST,1.0111,2,0.9473,1.0547,0.8978,1.1138,3365,3325,5.4199,6.6667,53,3.3
MAY21_APR22,SEP_22,41,R1K,LONDON NORTH WEST UNIVERSITY HEALTHCARE NHS TRUST,0.7815,3,0.9422,1.0602,0.8968,1.115,2155,2760,4.9899,5.3014,30,1.2
MAY21_APR22,SEP_22,41,RWF,MAIDSTONE AND TUNBRIDGE WELLS NHS TRUST,0.9727,2,0.9361,1.0669,0.8955,1.1166,2185,2245,4.7353,4.9538,30,1.2
MAY21_APR22,SEP_22,41,R0A,MANCHESTER UNIVERSITY NHS FOUNDATION TRUST,0.9484,2,0.9509,1.0509,0.8985,1.113,3645,3840,5.8714,5.5117,46,2.2
MAY21_APR22,SEP_22,41,RPA,MEDWAY NHS FOUNDATION TRUST,1.0499,2,0.9223,1.0821,0.8922,1.1208,1585,1510,5.7483,5.181,46,2
MAY21_APR22,SEP_22,41,RAJ,MID AND SOUTH ESSEX NHS FOUNDATION TRUST,1.0817,2,0.9573,1.044,0.8995,1.1117,5525,5110,5.0465,5.1398,28,1.6
MAY21_APR22,SEP_22,41,RBT,MID CHESHIRE HOSPITALS NHS FOUNDATION TRUST,0.9449,2,0.9215,1.0831,0.892,1.1211,1395,1475,5.8487,5.5766,29,1.5
MAY21_APR22,SEP_22,41,RXF,MID YORKSHIRE HOSPITALS NHS TRUST,1.0487,2,0.9378,1.0651,0.8959,1.1162,2490,2370,5.8101,6.1061,34,1.6
MAY21_APR22,SEP_22,41,RD8,MILTON KEYNES UNIVERSITY HOSPITAL NHS FOUNDATION TRUST,1.0807,2,0.91,1.096,0.8888,1.1252,1205,1115,4.7974,3.8194,53,2.2
MAY21_APR22,SEP_22,41,RM1,NORFOLK AND NORWICH UNIVERSITY HOSPITALS NHS FOUNDATION TRUST,1.1952,1,0.9403,1.0623,0.8964,1.1155,3085,2580,4.9675,5.0931,56,3.6
MAY21_APR22,SEP_22,41,RVJ,NORTH BRISTOL NHS TRUST,0.975,2,0.9353,1.0678,0.8954,1.1169,2135,2190,5.8387,5.371,44,1.7
MAY21_APR22,SEP_22,41,RNN,NORTH CUMBRIA INTEGRATED CARE NHS FOUNDATION TRUST,1.1199,1,0.9262,1.0778,0.8932,1.1196,1875,1675,4.233,5.1066,37,2.5
MAY21_APR22,SEP_22,41,RAP,NORTH MIDDLESEX UNIVERSITY HOSPITAL NHS TRUST,0.9268,2,0.9122,1.0936,0.8894,1.1244,1085,1170,4.9225,5.4442,42,2.3
MAY21_APR22,SEP_22,41,RVW,NORTH TEES AND HARTLEPOOL NHS FOUNDATION TRUST,0.976,2,0.9274,1.0765,0.8935,1.1192,1690,1735,6.3959,6.6092,41,2.1
MAY21_APR22,SEP_22,41,RGN,NORTH WEST ANGLIA NHS FOUNDATION TRUST,1.1042,2,0.9372,1.0657,0.8958,1.1163,2570,2325,3.8873,4.6586,44,2.6
MAY21_APR22,SEP_22,41,RNS,NORTHAMPTON GENERAL HOSPITAL NHS TRUST,0.9214,2,0.9288,1.075,0.8938,1.1188,1660,1800,4.3799,4.6433,49,1.6
