TIME_PERIOD,PUBLICATION_MONTH,ORDER,PROVIDER_CODE,PROVIDER_NAME,SHMI_VALUE,SHMI_BANDING,PO_LL,PO_UL,OD_LL,OD_UL,OBSERVED,EXPECTED,ELECTIVE_DEPTH,NONELECTIVE_DEPTH,PALLIATIVE_DEATHS,PALLIATIVE_CODE
DEC18_NOV19,APR_20,12,RAJ,SOUTHEND UNIVERSITY HOSPITAL NHS FOUNDATION TRUST,1.068,2,0.934,1.0693,0.8834,1.132,2245,2100,4.7033,5.3881,29,2
DEC18_NOV19,APR_20,12,RVY,SOUTHPORT AND ORMSKIRK HOSPITAL NHS TRUST,0.9808,2,0.9187,1.0862,0.88,1.1364,1345,1375,4.3829,4.9124,39,2.6
DEC18_NOV19,APR_20,12,RJ7,ST GEORGE'S UNIVERSITY HOSPITALS NHS FOUNDATION TRUST,0.8477,3,0.9371,1.0658,0.884,1.1312,1970,2320,5.8357,5.7205,48,1.8
DEC18_NOV19,APR_20,12,RBN,ST HELENS AND KNOWSLEY TEACHING HOSPITALS NHS TRUST,1.0934,2,0.936,1.067,0.8838,1.1315,2450,2240,5.7076,4.8395,37,1.7
DEC18_NOV19,APR_20,12,RWJ,STOCKPORT NHS FOUNDATION TRUST,0.9814,2,0.9289,1.0748,0.8823,1.1334,1775,1810,4.0524,4.3869,28,1.3
DEC18_NOV19,APR_20,12,RTP,SURREY AND SUSSEX HEALTHCARE NHS TRUST,0.9776,2,0.9321,1.0713,0.883,1.1325,1940,1985,5.8005,6.404,45,2.4
DEC18_NOV19,APR_20,12,RMP,TAMESIDE AND GLOSSOP INTEGRATED CARE NHS FOUNDATION TRUST,1.1475,1,0.9107,1.0952,0.878,1.139,1300,1135,5.8423,5.66,20,1.2
DEC18_NOV19,APR_20,12,RBA,TAUNTON AND SOMERSET NHS FOUNDATION TRUST,0.9358,2,0.9313,1.0722,0.8828,1.1327,1815,1940,4.7278,5.3159,26,1.3
DEC18_NOV19,APR_20,12,RNA,THE DUDLEY GROUP NHS FOUNDATION TRUST,1.1336,1,0.9338,1.0694,0.8833,1.1321,2375,2095,5.1273,5.3318,22,1.3
DEC18_NOV19,APR_20,12,RAS,THE HILLINGDON HOSPITALS NHS FOUNDATION TRUST,1.017,2,0.908,1.0983,0.8772,1.14,1085,1065,3.7405,3.8569,46,2.3
DEC18_NOV19,APR_20,12,RTD,THE NEWCASTLE UPON TYNE HOSPITALS NHS FOUNDATION TRUST,0.9761,2,0.9416,1.0609,0.8848,1.1302,2640,2705,5.3,4.8195,32,1.5
DEC18_NOV19,APR_20,12,RQW,THE PRINCESS ALEXANDRA HOSPITAL NHS TRUST,1.1043,2,0.9215,1.0831,0.8806,1.1355,1630,1475,4.287,4.3204,34,1.3
DEC18_NOV19,APR_20,12,RCX,"THE QUEEN ELIZABETH HOSPITAL, KING'S LYNN, NHS FOUNDATION TRUST",1.0073,2,0.9252,1.0789,0.8815,1.1344,1645,1630,3.8187,4.1222,15,0.7
DEC18_NOV19,APR_20,12,RFR,THE ROTHERHAM NHS FOUNDATION TRUST,1.1876,1,0.9157,1.0896,0.8792,1.1374,1515,1275,6.0153,6.0175,37,2
DEC18_NOV19,APR_20,12,RDZ,THE ROYAL BOURNEMOUTH AND CHRISTCHURCH HOSPITALS NHS FOUNDATION TRUST,0.864,3,0.9376,1.0653,0.8841,1.1311,2040,2360,3.3936,4.3133,59,3.1
DEC18_NOV19,APR_20,12,RL4,THE ROYAL WOLVERHAMPTON NHS TRUST,1.0615,2,0.9385,1.0643,0.8842,1.1309,2580,2430,7.3798,5.9546,23,1.4
DEC18_NOV19,APR_20,12,RA9,TORBAY AND SOUTH DEVON NHS FOUNDATION TRUST,0.9868,2,0.9281,1.0757,0.8821,1.1336,1745,1765,5.3041,4.13,30,1.6
DEC18_NOV19,APR_20,12,RWD,UNITED LINCOLNSHIRE HOSPITALS NHS TRUST,1.0985,2,0.9468,1.0552,0.8857,1.129,3595,3270,4.1497,5.09,30,2
DEC18_NOV19,APR_20,12,RRV,UNIVERSITY COLLEGE LONDON HOSPITALS NHS FOUNDATION TRUST,0.7053,3,0.9289,1.0748,0.8823,1.1334,1275,1810,5.629,6.0583,35,1
DEC18_NOV19,APR_20,12,RHM,UNIVERSITY HOSPITAL SOUTHAMPTON NHS FOUNDATION TRUST,0.8897,2,0.9448,1.0574,0.8854,1.1295,2700,3035,6.0778,7.1984,50,2.8
DEC18_NOV19,APR_20,12,RRK,UNIVERSITY HOSPITALS BIRMINGHAM NHS FOUNDATION TRUST,0.984,2,0.9645,1.0364,0.8881,1.1259,7295,7410,3.3559,4.4298,27,1.2
DEC18_NOV19,APR_20,12,RA7,UNIVERSITY HOSPITALS BRISTOL NHS FOUNDATION TRUST,1.017,2,0.9265,1.0775,0.8818,1.1341,1720,1690,5.4301,4.7549,33,1.3
DEC18_NOV19,APR_20,12,RKB,UNIVERSITY HOSPITALS COVENTRY AND WARWICKSHIRE NHS TRUST,1.0813,2,0.9411,1.0614,0.8847,1.1303,2870,2655,3.7552,3.9833,27,1.1
DEC18_NOV19,APR_20,12,RTG,UNIVERSITY HOSPITALS OF DERBY AND BURTON NHS FOUNDATION TRUST,0.9055,2,0.9565,1.0449,0.8872,1.1272,4450,4915,5.0699,5.2618,25,1.3
DEC18_NOV19,APR_20,12,RWE,UNIVERSITY HOSPITALS OF LEICESTER NHS TRUST,0.9608,2,0.9552,1.0462,0.887,1.1274,4455,4640,4.9916,4.7011,31,1.6
DEC18_NOV19,APR_20,12,RTX,UNIVERSITY HOSPITALS OF MORECAMBE BAY NHS FOUNDATION TRUST,1.0083,2,0.9294,1.0743,0.8824,1.1332,1850,1835,5.6482,5.5897,34,2.2
DEC18_NOV19,APR_20,12,RJE,UNIVERSITY HOSPITALS OF NORTH MIDLANDS NHS TRUST,0.9831,2,0.9544,1.0471,0.8869,1.1276,4400,4475,6.2907,5.3194,45,1.9
DEC18_NOV19,APR_20,12,RK9,UNIVERSITY HOSPITALS PLYMOUTH NHS TRUST,1.0988,2,0.9371,1.0658,0.884,1.1312,2555,2325,5.9544,5.1305,30,1.7
DEC18_NOV19,APR_20,12,RBK,WALSALL HEALTHCARE NHS TRUST,1.1038,2,0.919,1.0859,0.88,1.1363,1530,1385,4.8698,5.2898,29,1.4
DEC18_NOV19,APR_20,12,RWW,WARRINGTON AND HALTON TEACHING HOSPITALS NHS FOUNDATION TRUST,1.0553,2,0.9155,1.0898,0.8792,1.1374,1340,1270,6.6292,5.6595,41,1.6
DEC18_NOV19,APR_20,12,RWG,WEST HERTFORDSHIRE HOSPITALS NHS TRUST,1.0005,2,0.9344,1.0688,0.8835,1.1319,2130,2130,5.4401,5.3883,42,1.9
DEC18_NOV19,APR_20,12,RGR,WEST SUFFOLK NHS FOUNDATION TRUST,0.9134,2,0.9247,1.0795,0.8814,1.1346,1465,1605,4.7785,6.0488,45,2.8
DEC18_NOV19,APR_20,12,RYR,WESTERN SUSSEX HOSPITALS NHS FOUNDATION TRUST,1.0129,2,0.9455,1.0566,0.8855,1.1293,3155,3115,5.0215,5.5565,30,1.8
DEC18_NOV19,APR_20,12,RA3,WESTON AREA HEALTH NHS TRUST,1.0026,2,0.8983,1.1095,0.8745,1.1435,870,865,6.3275,6.776,36,3.3
DEC18_NOV19,APR_20,12,RKE,WHITTINGTON HEALTH NHS TRUST,0.8804,2,0.8864,1.1234,0.8708,1.1483,605,690,4.4082,5.5608,54,2.9
DEC18_NOV19,APR_20,12,RBL,WIRRAL UNIVERSITY TEACHING HOSPITAL NHS FOUNDATION TRUST,1.1067,2,0.9326,1.0707,0.8831,1.1324,2230,2015,5.2203,5.9774,48,2.4
DEC18_NOV19,APR_20,12,RWP,WORCESTERSHIRE ACUTE HOSPITALS NHS TRUST,1.0763,2,0.9415,1.061,0.8848,1.1302,2895,2690,4.4186,5.3963,35,2
DEC18_NOV19,APR_20,12,RRF,"WRIGHTINGTON, WIGAN AND LEIGH NHS FOUNDATION TRUST",1.1957,1,0.9225,1.0819,0.8809,1.1352,1815,1515,6.0341,5.908,43,2.6
DEC18_NOV19,APR_20,12,RLQ,WYE VALLEY NHS TRUST,1.033,2,0.9127,1.093,0.8785,1.1383,1225,1185,3.6841,4.8709,38,2.1
DEC18_NOV19,APR_20,12,RA4,YEOVIL DISTRICT HOSPITAL NHS FOUNDATION TRUST,0.9226,2,0.9119,1.0938,0.8783,1.1386,1075,1165,3.959,4.939,58,3.3
DEC18_NOV19,APR_20,12,RCB,YORK TEACHING HOSPITAL NHS FOUNDATION TRUST,0.9979,2,0.9461,1.056,0.8856,1.1292,3180,3185,3.9621,4.5822,29,1.6
JAN19_DEC19,MAY_20,13,RCF,AIREDALE NHS FOUNDATION TRUST,0.8842,2,0.9108,1.0952,0.8745,1.1436,1005,1135,4.2376,4.1563,27,1.4
JAN19_DEC19,MAY_20,13,RTK,ASHFORD AND ST PETER'S HOSPITALS NHS FOUNDATION TRUST,0.9721,2,0.9272,1.0768,0.8783,1.1386,1675,1720,4.1282,5.2694,38,2.1
JAN19_DEC19,MAY_20,13,RF4,"BARKING, HAVERING AND REDBRIDGE UNIVERSITY HOSPITALS NHS TRUST",1.0345,2,0.9439,1.0584,0.8815,1.1345,3030,2925,5.4364,5.6229,33,2
JAN19_DEC19,MAY_20,13,RFF,BARNSLEY HOSPITAL NHS FOUNDATION TRUST,1.0185,2,0.9244,1.0798,0.8777,1.1393,1625,1595,4.9061,5.2218,26,1.6
JAN19_DEC19,MAY_20,13,R1H,BARTS HEALTH NHS TRUST,0.9319,2,0.9517,1.05,0.8827,1.1329,3705,3975,6.6391,5.543,40,1.5
JAN19_DEC19,MAY_20,13,RDD,BASILDON AND THURROCK UNIVERSITY HOSPITALS NHS FOUNDATION TRUST,1.0423,2,0.9343,1.0688,0.8797,1.1367,2220,2130,5.8048,4.2941,34,2
JAN19_DEC19,MAY_20,13,RC1,BEDFORD HOSPITAL NHS TRUST,1.1222,2,0.9126,1.0931,0.8749,1.143,1330,1185,5.7625,5.6525,26,1.5
JAN19_DEC19,MAY_20,13,RXL,BLACKPOOL TEACHING HOSPITALS NHS FOUNDATION TRUST,1.1241,2,0.9347,1.0685,0.8798,1.1366,2415,2150,6.2566,5.9274,28,2
JAN19_DEC19,MAY_20,13,RMC,BOLTON NHS FOUNDATION TRUST,1.1646,1,0.9216,1.0829,0.8771,1.1402,1725,1480,4.9627,4.3975,27,1.3
JAN19_DEC19,MAY_20,13,RAE,BRADFORD TEACHING HOSPITALS NHS FOUNDATION TRUST,0.9606,2,0.932,1.0714,0.8793,1.1373,1900,1980,4.6514,4.2199,22,0.7
JAN19_DEC19,MAY_20,13,RXH,BRIGHTON AND SUSSEX UNIVERSITY HOSPITALS NHS TRUST,0.9789,2,0.9374,1.0655,0.8803,1.136,2295,2345,5.0188,5.0322,41,2.3
JAN19_DEC19,MAY_20,13,RXQ,BUCKINGHAMSHIRE HEALTHCARE NHS TRUST,1.0151,2,0.9244,1.0798,0.8777,1.1393,1620,1595,4.9336,3.7743,52,2.2
JAN19_DEC19,MAY_20,13,RWY,CALDERDALE AND HUDDERSFIELD NHS FOUNDATION TRUST,0.982,2,0.9369,1.066,0.8802,1.1361,2265,2305,4.7678,5.1123,36,1.8
JAN19_DEC19,MAY_20,13,RGT,CAMBRIDGE UNIVERSITY HOSPITALS NHS FOUNDATION TRUST,0.8449,3,0.9407,1.0619,0.8809,1.1352,2210,2615,3.6898,5.6597,45,2.4
JAN19_DEC19,MAY_20,13,RQM,CHELSEA AND WESTMINSTER HOSPITAL NHS FOUNDATION TRUST,0.7493,3,0.9348,1.0684,0.8798,1.1366,1615,2155,4.4329,4.9873,54,1.5
JAN19_DEC19,MAY_20,13,RFS,CHESTERFIELD ROYAL HOSPITAL NHS FOUNDATION TRUST,0.9879,2,0.9293,1.0744,0.8787,1.138,1810,1830,5.0837,5.7179,32,2
JAN19_DEC19,MAY_20,13,RJR,COUNTESS OF CHESTER HOSPITAL NHS FOUNDATION TRUST,1.0913,2,0.9202,1.0846,0.8767,1.1406,1555,1425,3.1231,3.2572,36,1.6
JAN19_DEC19,MAY_20,13,RXP,COUNTY DURHAM AND DARLINGTON NHS FOUNDATION TRUST,1.1513,1,0.9418,1.0607,0.8811,1.1349,3125,2715,4.4869,4.392,45,2.6
JAN19_DEC19,MAY_20,13,RJ6,CROYDON HEALTH SERVICES NHS TRUST,0.9582,2,0.9184,1.0865,0.8763,1.1411,1310,1365,3.6595,5.1353,51,2.8
JAN19_DEC19,MAY_20,13,RN7,DARTFORD AND GRAVESHAM NHS TRUST,1.0633,2,0.92,1.0847,0.8767,1.1406,1510,1420,2.8433,3.7367,48,1.8
JAN19_DEC19,MAY_20,13,RP5,DONCASTER AND BASSETLAW TEACHING HOSPITALS NHS FOUNDATION TRUST,1.1183,2,0.9401,1.0626,0.8808,1.1353,2865,2565,4.368,5.2213,49,2.6
JAN19_DEC19,MAY_20,13,RBD,DORSET COUNTY HOSPITAL NHS FOUNDATION TRUST,1.158,1,0.9031,1.1039,0.8724,1.1462,1110,960,3.088,3.7413,36,2
JAN19_DEC19,MAY_20,13,RWH,EAST AND NORTH HERTFORDSHIRE NHS TRUST,0.8897,2,0.9391,1.0636,0.8806,1.1356,2205,2480,4.4423,4.5743,34,1.6
JAN19_DEC19,MAY_20,13,RJN,EAST CHESHIRE NHS TRUST,1.1513,1,0.8954,1.1129,0.8703,1.1491,940,815,5.1332,5.2862,23,2
JAN19_DEC19,MAY_20,13,RVV,EAST KENT HOSPITALS UNIVERSITY NHS FOUNDATION TRUST,1.0683,2,0.9507,1.0511,0.8825,1.1331,4075,3815,4.2199,4.4407,29,1.6
JAN19_DEC19,MAY_20,13,RXR,EAST LANCASHIRE HOSPITALS NHS TRUST,1.071,2,0.9403,1.0623,0.8809,1.1353,2770,2585,5.9215,5.065,33,1.6
JAN19_DEC19,MAY_20,13,RDE,EAST SUFFOLK AND NORTH ESSEX NHS FOUNDATION TRUST,1.0831,2,0.9525,1.0492,0.8828,1.1328,4445,4105,5.0825,5.7307,33,2.2
JAN19_DEC19,MAY_20,13,RXC,EAST SUSSEX HEALTHCARE NHS TRUST,0.9725,2,0.9421,1.0604,0.8812,1.1349,2675,2750,5.2402,6.0848,35,2.2
JAN19_DEC19,MAY_20,13,RVR,EPSOM AND ST HELIER UNIVERSITY HOSPITALS NHS TRUST,0.9245,2,0.9318,1.0716,0.8793,1.1373,1820,1970,5.8219,5.2266,49,2.1
JAN19_DEC19,MAY_20,13,RDU,FRIMLEY HEALTH NHS FOUNDATION TRUST,0.973,2,0.9502,1.0516,0.8825,1.1332,3635,3735,3.5688,4.1246,43,1.9
JAN19_DEC19,MAY_20,13,RR7,GATESHEAD HEALTH NHS FOUNDATION TRUST,1.0482,2,0.9179,1.0871,0.8762,1.1413,1415,1350,4.8912,6.0186,35,2.3
JAN19_DEC19,MAY_20,13,RLT,GEORGE ELIOT HOSPITAL NHS TRUST,1.1263,2,0.9056,1.1011,0.8731,1.1453,1135,1010,4.2925,5.3489,25,1.8
JAN19_DEC19,MAY_20,13,RTE,GLOUCESTERSHIRE HOSPITALS NHS FOUNDATION TRUST,1.0526,2,0.9433,1.0591,0.8814,1.1346,3015,2865,4.139,4.8483,32,1.7
JAN19_DEC19,MAY_20,13,RN3,GREAT WESTERN HOSPITALS NHS FOUNDATION TRUST,0.9497,2,0.9304,1.0731,0.879,1.1377,1795,1890,3.342,3.6371,37,2
JAN19_DEC19,MAY_20,13,RJ1,GUY'S AND ST THOMAS' NHS FOUNDATION TRUST,0.7456,3,0.932,1.0714,0.8793,1.1373,1480,1980,5.908,6.197,57,1.7
JAN19_DEC19,MAY_20,13,RN5,HAMPSHIRE HOSPITALS NHS FOUNDATION TRUST,1.0081,2,0.9351,1.068,0.8799,1.1365,2195,2175,3.8691,4.6104,42,2
JAN19_DEC19,MAY_20,13,RCD,HARROGATE AND DISTRICT NHS FOUNDATION TRUST,0.9722,2,0.9052,1.1015,0.873,1.1455,975,1000,3.5901,4.1687,31,1.5
JAN19_DEC19,MAY_20,13,RQX,HOMERTON UNIVERSITY HOSPITAL NHS FOUNDATION TRUST,0.7703,3,0.8864,1.1234,0.8676,1.1527,530,690,4.6452,5.0189,48,1
JAN19_DEC19,MAY_20,13,RWA,HULL UNIVERSITY TEACHING HOSPITALS NHS TRUST,1.0393,2,0.9468,1.0552,0.8819,1.1339,3400,3270,6.4087,5.749,35,2.5
JAN19_DEC19,MAY_20,13,RYJ,IMPERIAL COLLEGE HEALTHCARE NHS TRUST,0.6889,3,0.9455,1.0567,0.8817,1.1342,2140,3105,6.9314,6.7376,58,2.2
JAN19_DEC19,MAY_20,13,R1F,ISLE OF WIGHT NHS TRUST,1.053,2,0.8975,1.1105,0.8709,1.1483,895,850,5.6887,5.9317,56,3.7
JAN19_DEC19,MAY_20,13,RGP,JAMES PAGET UNIVERSITY HOSPITALS NHS FOUNDATION TRUST,1.0774,2,0.9237,1.0806,0.8775,1.1396,1685,1565,4.7891,5.5248,28,2.2
JAN19_DEC19,MAY_20,13,RNQ,KETTERING GENERAL HOSPITAL NHS FOUNDATION TRUST,1.0142,2,0.9261,1.078,0.8781,1.1389,1695,1670,5.9883,6.228,35,1.7
JAN19_DEC19,MAY_20,13,RJZ,KING'S COLLEGE HOSPITAL NHS FOUNDATION TRUST,0.9411,2,0.9468,1.0552,0.8819,1.1339,3080,3270,5.2327,6.051,51,2.2
JAN19_DEC19,MAY_20,13,RAX,KINGSTON HOSPITAL NHS FOUNDATION TRUST,0.768,3,0.9235,1.0809,0.8775,1.1396,1195,1555,4.4245,4.3595,49,1.4
JAN19_DEC19,MAY_20,13,RXN,LANCASHIRE TEACHING HOSPITALS NHS FOUNDATION TRUST,0.9783,2,0.9384,1.0644,0.8805,1.1357,2370,2425,5.8249,5.4084,53,2.4
JAN19_DEC19,MAY_20,13,RR8,LEEDS TEACHING HOSPITALS NHS TRUST,1.0838,2,0.9509,1.0508,0.8826,1.1331,4170,3850,4.2967,4.9723,32,1.7
JAN19_DEC19,MAY_20,13,RJ2,LEWISHAM AND GREENWICH NHS TRUST,0.9467,2,0.9397,1.0629,0.8807,1.1354,2395,2530,3.8544,4.3802,26,1.1
JAN19_DEC19,MAY_20,13,REM,LIVERPOOL UNIVERSITY HOSPITALS NHS FOUNDATION TRUST,1.0125,2,0.9522,1.0495,0.8827,1.1328,4105,4055,4.1932,4.8635,47,2.5
JAN19_DEC19,MAY_20,13,R1K,LONDON NORTH WEST UNIVERSITY HEALTHCARE NHS TRUST,0.8256,3,0.9452,1.057,0.8817,1.1342,2535,3075,5.4483,4.9359,36,1.5
JAN19_DEC19,MAY_20,13,RC9,LUTON AND DUNSTABLE UNIVERSITY HOSPITAL NHS FOUNDATION TRUST,1.0159,2,0.928,1.0758,0.8785,1.1383,1790,1765,4.6619,4.5736,42,1.2
JAN19_DEC19,MAY_20,13,R0A,MANCHESTER UNIVERSITY NHS FOUNDATION TRUST,0.9519,2,0.9491,1.0528,0.8823,1.1334,3405,3575,5.6369,5.1785,45,2.4
JAN19_DEC19,MAY_20,13,RPA,MEDWAY NHS FOUNDATION TRUST,1.1146,2,0.9279,1.0759,0.8784,1.1384,1960,1755,4.9595,4.9673,44,2.3
JAN19_DEC19,MAY_20,13,RBT,MID CHESHIRE HOSPITALS NHS FOUNDATION TRUST,1.0038,2,0.9224,1.082,0.8773,1.1399,1520,1510,5.5774,4.907,26,1.6
JAN19_DEC19,MAY_20,13,RQ8,MID ESSEX HOSPITAL SERVICES NHS TRUST,1.1094,2,0.9292,1.0745,0.8787,1.138,2020,1825,4.1235,5.021,35,1.6
JAN19_DEC19,MAY_20,13,RXF,MID YORKSHIRE HOSPITALS NHS TRUST,1.0637,2,0.943,1.0594,0.8813,1.1347,3020,2840,4.731,4.5868,26,1.5
JAN19_DEC19,MAY_20,13,RD8,MILTON KEYNES UNIVERSITY HOSPITAL NHS FOUNDATION TRUST,1.158,1,0.9132,1.0924,0.8751,1.1428,1390,1200,4.3065,4.541,50,2.4
JAN19_DEC19,MAY_20,13,RM1,NORFOLK AND NORWICH UNIVERSITY HOSPITALS NHS FOUNDATION TRUST,1.1338,2,0.9465,1.0556,0.8819,1.1339,3655,3225,5.074,4.7438,50,3.2
JAN19_DEC19,MAY_20,13,RVJ,NORTH BRISTOL NHS TRUST,0.8776,3,0.9395,1.0632,0.8807,1.1355,2205,2510,5.3528,5.3004,43,1.5
JAN19_DEC19,MAY_20,13,RNN,NORTH CUMBRIA INTEGRATED CARE NHS FOUNDATION TRUST,0.9982,2,0.9313,1.0722,0.8791,1.1375,1935,1940,3.9876,4.8419,34,2.4
JAN19_DEC19,MAY_20,13,RAP,NORTH MIDDLESEX UNIVERSITY HOSPITAL NHS TRUST,0.8742,3,0.921,1.0836,0.8769,1.1403,1275,1460,4.4252,4.2409,29,1.5
JAN19_DEC19,MAY_20,13,RVW,NORTH TEES AND HARTLEPOOL NHS FOUNDATION TRUST,0.9793,2,0.9343,1.0688,0.8797,1.1367,2085,2125,6.2214,6.4289,41,2.3
JAN19_DEC19,MAY_20,13,RGN,NORTH WEST ANGLIA NHS FOUNDATION TRUST,1.1282,2,0.9406,1.062,0.8809,1.1352,2945,2610,3.208,4.247,34,2.3
JAN19_DEC19,MAY_20,13,RNS,NORTHAMPTON GENERAL HOSPITAL NHS TRUST,1.0051,2,0.9339,1.0693,0.8797,1.1368,2110,2100,4.0724,4.6749,40,1.5
JAN19_DEC19,MAY_20,13,RBZ,NORTHERN DEVON HEALTHCARE NHS TRUST,1.0189,2,0.9045,1.1023,0.8728,1.1457,1005,985,3.5654,4.8182,18,1
JAN19_DEC19,MAY_20,13,RJL,NORTHERN LINCOLNSHIRE AND GOOLE NHS FOUNDATION TRUST,1.1629,1,0.9352,1.0679,0.8799,1.1365,2540,2185,4.4265,5.23,19,1.5
JAN19_DEC19,MAY_20,13,RTF,NORTHUMBRIA HEALTHCARE NHS FOUNDATION TRUST,1.0286,2,0.9463,1.0558,0.8818,1.134,3295,3200,4.8456,4.7147,40,2.5
JAN19_DEC19,MAY_20,13,RX1,NOTTINGHAM UNIVERSITY HOSPITALS NHS TRUST,1.044,2,0.9537,1.0478,0.883,1.1326,4525,4330,6.7915,6.4307,40,2
JAN19_DEC19,MAY_20,13,RTH,OXFORD UNIVERSITY HOSPITALS NHS FOUNDATION TRUST,0.9175,2,0.9488,1.0531,0.8822,1.1335,3245,3535,5.7821,5.7031,51,2.2
JAN19_DEC19,MAY_20,13,RW6,PENNINE ACUTE HOSPITALS NHS TRUST,1.076,2,0.9505,1.0513,0.8825,1.1332,4065,3780,4.925,5.5115,30,1.6
JAN19_DEC19,MAY_20,13,RD3,POOLE HOSPITAL NHS FOUNDATION TRUST,0.8871,2,0.9288,1.075,0.8786,1.1381,1600,1800,4.4597,5.196,28,1.3
JAN19_DEC19,MAY_20,13,RHU,PORTSMOUTH HOSPITALS NHS TRUST,1.0554,2,0.9444,1.0579,0.8815,1.1344,3150,2985,5.0452,5.6637,42,2
JAN19_DEC19,MAY_20,13,RHW,ROYAL BERKSHIRE NHS FOUNDATION TRUST,1.1184,2,0.9315,1.072,0.8792,1.1374,2180,1950,2.9947,3.8193,51,2.3
JAN19_DEC19,MAY_20,13,REF,ROYAL CORNWALL HOSPITALS NHS TRUST,0.9021,2,0.9395,1.0631,0.8807,1.1355,2270,2515,5.0622,5.073,34,1.9
JAN19_DEC19,MAY_20,13,RH8,ROYAL DEVON AND EXETER NHS FOUNDATION TRUST,1.1164,2,0.934,1.0692,0.8797,1.1368,2350,2105,3.9316,4.1292,34,2
JAN19_DEC19,MAY_20,13,RAL,ROYAL FREE LONDON NHS FOUNDATION TRUST,0.8146,3,0.9465,1.0556,0.8819,1.1339,2625,3225,5.8159,5.4026,36,1.5
JAN19_DEC19,MAY_20,13,RA2,ROYAL SURREY COUNTY HOSPITAL NHS FOUNDATION TRUST,0.8047,3,0.9237,1.0806,0.8775,1.1396,1260,1565,5.9744,6.0593,58,2.3
JAN19_DEC19,MAY_20,13,RD1,ROYAL UNITED HOSPITALS BATH NHS FOUNDATION TRUST,1.0256,2,0.9319,1.0715,0.8793,1.1373,2030,1975,4.411,4.7069,26,1.4
JAN19_DEC19,MAY_20,13,RM3,SALFORD ROYAL NHS FOUNDATION TRUST,0.9299,2,0.9295,1.0742,0.8788,1.138,1710,1840,6.451,6.6351,55,3.4
JAN19_DEC19,MAY_20,13,RNZ,SALISBURY NHS FOUNDATION TRUST,1.028,2,0.9055,1.1012,0.8731,1.1454,1035,1010,4.2144,4.222,51,2.1
JAN19_DEC19,MAY_20,13,RXK,SANDWELL AND WEST BIRMINGHAM HOSPITALS NHS TRUST,1.0752,2,0.932,1.0714,0.8793,1.1373,2130,1980,5.2775,5.1662,21,1
JAN19_DEC19,MAY_20,13,RHQ,SHEFFIELD TEACHING HOSPITALS NHS FOUNDATION TRUST,1.0065,2,0.9493,1.0526,0.8823,1.1334,3625,3600,5.6884,5.4273,35,1.9
JAN19_DEC19,MAY_20,13,RK5,SHERWOOD FOREST HOSPITALS NHS FOUNDATION TRUST,0.9685,2,0.9345,1.0686,0.8798,1.1366,2075,2140,5.0799,5.5643,10,0.5
JAN19_DEC19,MAY_20,13,RXW,SHREWSBURY AND TELFORD HOSPITAL NHS TRUST,1.024,2,0.9418,1.0606,0.8811,1.1349,2790,2725,5.1553,5.5086,30,1.8
JAN19_DEC19,MAY_20,13,RTR,SOUTH TEES HOSPITALS NHS FOUNDATION TRUST,1.119,2,0.9384,1.0643,0.8805,1.1357,2715,2425,4.3846,4.6115,37,1.8
JAN19_DEC19,MAY_20,13,R0B,SOUTH TYNESIDE AND SUNDERLAND NHS FOUNDATION TRUST,1.0472,2,0.9452,1.0569,0.8817,1.1342,3225,3080,4.1743,5.5663,27,2.1
JAN19_DEC19,MAY_20,13,RJC,SOUTH WARWICKSHIRE NHS FOUNDATION TRUST,0.9835,2,0.9147,1.0907,0.8754,1.1423,1225,1245,4.4385,5.235,22,1.1
JAN19_DEC19,MAY_20,13,RAJ,SOUTHEND UNIVERSITY HOSPITAL NHS FOUNDATION TRUST,1.0745,2,0.9341,1.0691,0.8797,1.1367,2270,2115,4.6938,5.4249,28,1.9
JAN19_DEC19,MAY_20,13,RVY,SOUTHPORT AND ORMSKIRK HOSPITAL NHS TRUST,0.9923,2,0.918,1.0869,0.8762,1.1412,1340,1350,4.3944,4.8843,40,2.7
JAN19_DEC19,MAY_20,13,RJ7,ST GEORGE'S UNIVERSITY HOSPITALS NHS FOUNDATION TRUST,0.8624,3,0.9371,1.0658,0.8803,1.136,2000,2320,5.8472,5.7132,47,1.8
JAN19_DEC19,MAY_20,13,RBN,ST HELENS AND KNOWSLEY TEACHING HOSPITALS NHS TRUST,1.0881,2,0.936,1.067,0.8801,1.1363,2440,2245,5.7929,4.8807,38,1.8
JAN19_DEC19,MAY_20,13,RWJ,STOCKPORT NHS FOUNDATION TRUST,0.9827,2,0.929,1.0747,0.8787,1.1381,1780,1815,4.0568,4.3912,28,1.3
JAN19_DEC19,MAY_20,13,RTP,SURREY AND SUSSEX HEALTHCARE NHS TRUST,0.9681,2,0.9326,1.0708,0.8794,1.1371,1950,2015,5.8337,6.4498,45,2.4
JAN19_DEC19,MAY_20,13,RMP,TAMESIDE AND GLOSSOP INTEGRATED CARE NHS FOUNDATION TRUST,1.1442,1,0.9114,1.0944,0.8746,1.1433,1320,1150,5.9197,5.7844,20,1.3
JAN19_DEC19,MAY_20,13,RBA,TAUNTON AND SOMERSET NHS FOUNDATION TRUST,0.9496,2,0.9315,1.0719,0.8792,1.1374,1855,1950,4.6892,5.327,25,1.3
JAN19_DEC19,MAY_20,13,RNA,THE DUDLEY GROUP NHS FOUNDATION TRUST,1.1422,1,0.9341,1.0691,0.8797,1.1368,2410,2110,5.071,5.3114,22,1.3
JAN19_DEC19,MAY_20,13,RAS,THE HILLINGDON HOSPITALS NHS FOUNDATION TRUST,0.9785,2,0.9088,1.0974,0.874,1.1442,1060,1085,3.745,3.8689,48,2.3
JAN19_DEC19,MAY_20,13,RTD,THE NEWCASTLE UPON TYNE HOSPITALS NHS FOUNDATION TRUST,0.97,2,0.9418,1.0606,0.8811,1.1349,2640,2725,5.3404,4.799,31,1.5
JAN19_DEC19,MAY_20,13,RQW,THE PRINCESS ALEXANDRA HOSPITAL NHS TRUST,1.0956,2,0.9219,1.0826,0.8771,1.1401,1635,1490,4.3485,4.3908,35,1.3
JAN19_DEC19,MAY_20,13,RCX,"THE QUEEN ELIZABETH HOSPITAL, KING'S LYNN, NHS FOUNDATION TRUST",1.0021,2,0.9256,1.0785,0.878,1.139,1650,1650,3.8742,4.1666,15,0.7
JAN19_DEC19,MAY_20,13,RFR,THE ROTHERHAM NHS FOUNDATION TRUST,1.1908,1,0.9154,1.0899,0.8756,1.142,1510,1265,6.0316,6.0206,35,2
JAN19_DEC19,MAY_20,13,RDZ,THE ROYAL BOURNEMOUTH AND CHRISTCHURCH HOSPITALS NHS FOUNDATION TRUST,0.8612,3,0.938,1.0648,0.8804,1.1358,2065,2395,3.3901,4.3651,60,3.2
JAN19_DEC19,MAY_20,13,RL4,THE ROYAL WOLVERHAMPTON NHS TRUST,1.058,2,0.9388,1.064,0.8806,1.1356,2595,2450,7.5204,6.0481,24,1.4
JAN19_DEC19,MAY_20,13,RA9,TORBAY AND SOUTH DEVON NHS FOUNDATION TRUST,0.9893,2,0.9284,1.0754,0.8786,1.1382,1765,1785,5.312,4.1504,31,1.7
JAN19_DEC19,MAY_20,13,RWD,UNITED LINCOLNSHIRE HOSPITALS NHS TRUST,1.0973,2,0.9471,1.0549,0.882,1.1338,3630,3305,4.2102,5.1594,29,2
JAN19_DEC19,MAY_20,13,RRV,UNIVERSITY COLLEGE LONDON HOSPITALS NHS FOUNDATION TRUST,0.7021,3,0.9299,1.0738,0.8789,1.1378,1305,1860,5.5912,6.1343,35,1
JAN19_DEC19,MAY_20,13,RHM,UNIVERSITY HOSPITAL SOUTHAMPTON NHS FOUNDATION TRUST,0.8768,3,0.9452,1.0569,0.8817,1.1342,2700,3080,6.1299,7.2739,50,2.8
JAN19_DEC19,MAY_20,13,RRK,UNIVERSITY HOSPITALS BIRMINGHAM NHS FOUNDATION TRUST,0.9837,2,0.9647,1.0362,0.8843,1.1309,7375,7495,3.4102,4.4853,27,1.2
JAN19_DEC19,MAY_20,13,RA7,UNIVERSITY HOSPITALS BRISTOL NHS FOUNDATION TRUST,1.0044,2,0.927,1.0769,0.8783,1.1386,1720,1715,5.4451,4.7748,34,1.3
JAN19_DEC19,MAY_20,13,RKB,UNIVERSITY HOSPITALS COVENTRY AND WARWICKSHIRE NHS TRUST,1.0784,2,0.9412,1.0613,0.881,1.1351,2875,2670,3.7511,3.9999,27,1.1
JAN19_DEC19,MAY_20,13,RTG,UNIVERSITY HOSPITALS OF DERBY AND BURTON NHS FOUNDATION TRUST,0.8931,2,0.9571,1.0442,0.8834,1.132,4515,5055,5.1758,5.3832,25,1.4
JAN19_DEC19,MAY_20,13,RWE,UNIVERSITY HOSPITALS OF LEICESTER NHS TRUST,0.952,2,0.9555,1.0459,0.8832,1.1323,4470,4695,5.0961,4.7836,31,1.6
JAN19_DEC19,MAY_20,13,RTX,UNIVERSITY HOSPITALS OF MORECAMBE BAY NHS FOUNDATION TRUST,1.0273,2,0.9296,1.074,0.8788,1.1379,1900,1850,5.7105,5.6442,33,2.2
JAN19_DEC19,MAY_20,13,RJE,UNIVERSITY HOSPITALS OF NORTH MIDLANDS NHS TRUST,0.9879,2,0.9546,1.0469,0.8831,1.1324,4455,4510,6.3249,5.3592,46,1.9
JAN19_DEC19,MAY_20,13,RK9,UNIVERSITY HOSPITALS PLYMOUTH NHS TRUST,1.0995,2,0.9375,1.0654,0.8803,1.1359,2585,2350,5.9484,5.1293,30,1.7
JAN19_DEC19,MAY_20,13,RBK,WALSALL HEALTHCARE NHS TRUST,1.105,2,0.9195,1.0853,0.8766,1.1408,1550,1405,4.7664,5.3002,29,1.3
JAN19_DEC19,MAY_20,13,RWW,WARRINGTON AND HALTON TEACHING HOSPITALS NHS FOUNDATION TRUST,1.0542,2,0.9164,1.0888,0.8759,1.1417,1370,1300,6.7542,5.6789,42,1.7
JAN19_DEC19,MAY_20,13,RWG,WEST HERTFORDSHIRE HOSPITALS NHS TRUST,0.9974,2,0.9346,1.0685,0.8798,1.1366,2140,2150,5.4549,5.3271,41,1.8
JAN19_DEC19,MAY_20,13,RGR,WEST SUFFOLK NHS FOUNDATION TRUST,0.9204,2,0.9254,1.0787,0.8779,1.1391,1510,1640,4.8151,6.0891,45,2.8
JAN19_DEC19,MAY_20,13,RYR,WESTERN SUSSEX HOSPITALS NHS FOUNDATION TRUST,1.002,2,0.9457,1.0565,0.8818,1.1341,3140,3130,5.0146,5.5718,31,1.8
JAN19_DEC19,MAY_20,13,RA3,WESTON AREA HEALTH NHS TRUST,1.0037,2,0.8987,1.109,0.8712,1.1478,875,875,6.41,6.8863,36,3.3
JAN19_DEC19,MAY_20,13,RKE,WHITTINGTON HEALTH NHS TRUST,0.8874,2,0.8865,1.1232,0.8676,1.1526,615,690,4.4184,5.6127,52,2.9
JAN19_DEC19,MAY_20,13,RBL,WIRRAL UNIVERSITY TEACHING HOSPITAL NHS FOUNDATION TRUST,1.1254,2,0.9326,1.0708,0.8794,1.1371,2265,2015,5.1992,5.9503,48,2.5
JAN19_DEC19,MAY_20,13,RWP,WORCESTERSHIRE ACUTE HOSPITALS NHS TRUST,1.0628,2,0.9419,1.0605,0.8811,1.1349,2905,2735,4.4734,5.4147,35,2
JAN19_DEC19,MAY_20,13,RRF,"WRIGHTINGTON, WIGAN AND LEIGH NHS FOUNDATION TRUST",1.1999,1,0.9225,1.0819,0.8773,1.1399,1820,1515,6.0791,5.9198,43,2.6
JAN19_DEC19,MAY_20,13,RLQ,WYE VALLEY NHS TRUST,1.0284,2,0.913,1.0927,0.875,1.1428,1230,1195,3.7058,4.8563,36,2.1
JAN19_DEC19,MAY_20,13,RA4,YEOVIL DISTRICT HOSPITAL NHS FOUNDATION TRUST,0.8988,2,0.9123,1.0935,0.8748,1.1431,1055,1175,3.998,4.9316,57,3.2
JAN19_DEC19,MAY_20,13,RCB,YORK TEACHING HOSPITAL NHS FOUNDATION TRUST,0.9946,2,0.9464,1.0557,0.8819,1.134,3195,3210,3.9686,4.6152,29,1.6
FEB19_JAN20,JUN_20,14,RCF,AIREDALE NHS FOUNDATION TRUST,0.8747,3,0.911,1.095,0.8761,1.1414,995,1140,4.2632,4.192,28,1.4
FEB19_JAN20,JUN_20,14,RTK,ASHFORD AND ST PETER'S HOSPITALS NHS FOUNDATION TRUST,0.9564,2,0.9266,1.0774,0.8798,1.1366,1620,1695,4.1598,5.2884,39,2.1
FEB19_JAN20,JUN_20,14,RF4,"BARKING, HAVERING AND REDBRIDGE UNIVERSITY HOSPITALS NHS TRUST",1.0231,2,0.9439,1.0584,0.8832,1.1323,3000,2935,5.4918,5.6857,33,1.9
FEB19_JAN20,JUN_20,14,RFF,BARNSLEY HOSPITAL NHS FOUNDATION TRUST,1.0226,2,0.924,1.0803,0.8792,1.1374,1615,1575,4.9181,5.3015,26,1.6
FEB19_JAN20,JUN_20,14,R1H,BARTS HEALTH NHS TRUST,0.9189,2,0.9516,1.0501,0.8844,1.1308,3635,3955,6.6751,5.5497,40,1.5
FEB19_JAN20,JUN_20,14,RDD,BASILDON AND THURROCK UNIVERSITY HOSPITALS NHS FOUNDATION TRUST,1.037,2,0.9344,1.0688,0.8814,1.1345,2205,2130,5.7975,4.2998,35,2
FEB19_JAN20,JUN_20,14,RC1,BEDFORD HOSPITAL NHS TRUST,1.1366,2,0.9123,1.0935,0.8764,1.141,1335,1175,5.7406,5.6453,27,1.5
FEB19_JAN20,JUN_20,14,RXL,BLACKPOOL TEACHING HOSPITALS NHS FOUNDATION TRUST,1.1078,2,0.9347,1.0685,0.8815,1.1345,2380,2150,6.3252,5.9759,28,2
FEB19_JAN20,JUN_20,14,RMC,BOLTON NHS FOUNDATION TRUST,1.176,1,0.9214,1.0832,0.8786,1.1381,1730,1475,4.9378,4.3633,27,1.3
FEB19_JAN20,JUN_20,14,RAE,BRADFORD TEACHING HOSPITALS NHS FOUNDATION TRUST,0.9573,2,0.9318,1.0717,0.8809,1.1352,1885,1965,4.6675,4.2091,22,0.7
FEB19_JAN20,JUN_20,14,RXH,BRIGHTON AND SUSSEX UNIVERSITY HOSPITALS NHS TRUST,0.9924,2,0.937,1.066,0.8819,1.1339,2295,2310,5.062,5.0285,40,2.2
FEB19_JAN20,JUN_20,14,RXQ,BUCKINGHAMSHIRE HEALTHCARE NHS TRUST,1.0446,2,0.9242,1.08,0.8793,1.1373,1660,1585,4.9941,3.8178,51,2.2
FEB19_JAN20,JUN_20,14,RWY,CALDERDALE AND HUDDERSFIELD NHS FOUNDATION TRUST,0.9733,2,0.9369,1.0661,0.8819,1.1339,2245,2305,4.7657,5.116,37,1.8
FEB19_JAN20,JUN_20,14,RGT,CAMBRIDGE UNIVERSITY HOSPITALS NHS FOUNDATION TRUST,0.8577,3,0.9404,1.0622,0.8825,1.1331,2220,2590,3.6983,5.6955,45,2.4
FEB19_JAN20,JUN_20,14,RQM,CHELSEA AND WESTMINSTER HOSPITAL NHS FOUNDATION TRUST,0.7626,3,0.9348,1.0683,0.8815,1.1344,1645,2160,4.3538,4.9783,54,1.5
FEB19_JAN20,JUN_20,14,RFS,CHESTERFIELD ROYAL HOSPITAL NHS FOUNDATION TRUST,0.9805,2,0.9292,1.0745,0.8804,1.1359,1790,1825,5.1408,5.7878,33,2
FEB19_JAN20,JUN_20,14,RJR,COUNTESS OF CHESTER HOSPITAL NHS FOUNDATION TRUST,1.0979,2,0.9202,1.0846,0.8784,1.1385,1565,1425,3.1908,3.3494,36,1.6
FEB19_JAN20,JUN_20,14,RXP,COUNTY DURHAM AND DARLINGTON NHS FOUNDATION TRUST,1.1421,1,0.9416,1.0609,0.8828,1.1328,3090,2705,4.5222,4.4771,45,2.7
