TIME_PERIOD,PUBLICATION_MONTH,ORDER,PROVIDER_CODE,PROVIDER_NAME,SHMI_VALUE,SHMI_BANDING,PO_LL,PO_UL,OD_LL,OD_UL,OBSERVED,EXPECTED,ELECTIVE_DEPTH,NONELECTIVE_DEPTH,PALLIATIVE_DEATHS,PALLIATIVE_CODE
FEB20_JAN21,JUN_21,26,RP5,DONCASTER AND BASSETLAW TEACHING HOSPITALS NHS FOUNDATION TRUST,1.1018,2,0.9315,1.072,0.8933,1.1194,2145,1950,4.6314,5.6595,44,2.4
FEB20_JAN21,JUN_21,26,RBD,DORSET COUNTY HOSPITAL NHS FOUNDATION TRUST,1.1295,2,0.9005,1.107,0.8847,1.1303,1025,905,5.0316,6.0261,45,3.1
FEB20_JAN21,JUN_21,26,RWH,EAST AND NORTH HERTFORDSHIRE NHS TRUST,0.867,3,0.9338,1.0694,0.8939,1.1187,1815,2090,4.397,5.548,34,1.8
FEB20_JAN21,JUN_21,26,RJN,EAST CHESHIRE NHS TRUST,1.0089,2,0.8831,1.1273,0.8789,1.1378,655,650,5.8439,6.9502,22,2
FEB20_JAN21,JUN_21,26,RVV,EAST KENT HOSPITALS UNIVERSITY NHS FOUNDATION TRUST,1.0432,2,0.943,1.0593,0.8958,1.1163,2965,2845,4.6407,5.5292,37,1.9
FEB20_JAN21,JUN_21,26,RXR,EAST LANCASHIRE HOSPITALS NHS TRUST,1.0806,2,0.9327,1.0706,0.8936,1.119,2190,2025,5.4778,5.2165,32,1.6
FEB20_JAN21,JUN_21,26,RDE,EAST SUFFOLK AND NORTH ESSEX NHS FOUNDATION TRUST,1.0658,2,0.947,1.055,0.8966,1.1154,3510,3295,5.4527,6.2486,31,2.1
FEB20_JAN21,JUN_21,26,RXC,EAST SUSSEX HEALTHCARE NHS TRUST,0.9559,2,0.9359,1.0672,0.8943,1.1182,2135,2230,6.0027,6.9875,39,2.4
FEB20_JAN21,JUN_21,26,RVR,EPSOM AND ST HELIER UNIVERSITY HOSPITALS NHS TRUST,0.9652,2,0.9217,1.0828,0.8909,1.1224,1435,1485,5.6504,6.0955,40,2
FEB20_JAN21,JUN_21,26,RDU,FRIMLEY HEALTH NHS FOUNDATION TRUST,0.9766,2,0.9437,1.0586,0.8959,1.1161,2845,2910,4.1059,5.1393,42,2.2
FEB20_JAN21,JUN_21,26,RR7,GATESHEAD HEALTH NHS FOUNDATION TRUST,1.0123,2,0.913,1.0926,0.8885,1.1255,1210,1195,5.5285,6.9934,39,2.6
FEB20_JAN21,JUN_21,26,RLT,GEORGE ELIOT HOSPITAL NHS TRUST,1.0422,2,0.8967,1.1114,0.8835,1.1318,875,840,4.07,5.6309,30,1.9
FEB20_JAN21,JUN_21,26,RTE,GLOUCESTERSHIRE HOSPITALS NHS FOUNDATION TRUST,0.992,2,0.9399,1.0627,0.8952,1.1171,2530,2550,4.8169,4.9985,33,1.6
FEB20_JAN21,JUN_21,26,RN3,GREAT WESTERN HOSPITALS NHS FOUNDATION TRUST,0.9619,2,0.9249,1.0792,0.8917,1.1214,1555,1620,4.5688,4.7839,34,2
FEB20_JAN21,JUN_21,26,RJ1,GUY'S AND ST THOMAS' NHS FOUNDATION TRUST,0.7362,3,0.925,1.0792,0.8917,1.1214,1190,1620,6.266,6.6275,55,1.9
FEB20_JAN21,JUN_21,26,RN5,HAMPSHIRE HOSPITALS NHS FOUNDATION TRUST,0.9726,2,0.9307,1.0728,0.8932,1.1196,1855,1905,3.5934,5.3693,38,2
FEB20_JAN21,JUN_21,26,RCD,HARROGATE AND DISTRICT NHS FOUNDATION TRUST,0.9318,2,0.8925,1.1162,0.8821,1.1336,720,775,3.713,4.7298,28,1.5
FEB20_JAN21,JUN_21,26,RQX,HOMERTON UNIVERSITY HOSPITAL NHS FOUNDATION TRUST,0.8775,2,0.8723,1.1402,0.8749,1.143,475,540,6.4049,6.7465,44,1
FEB20_JAN21,JUN_21,26,RWA,HULL UNIVERSITY TEACHING HOSPITALS NHS TRUST,1.1353,1,0.939,1.0637,0.895,1.1173,2810,2475,7.3051,6.5229,31,2.5
FEB20_JAN21,JUN_21,26,RYJ,IMPERIAL COLLEGE HEALTHCARE NHS TRUST,0.7633,3,0.9364,1.0665,0.8944,1.118,1735,2275,7.4756,7.3715,58,2.5
FEB20_JAN21,JUN_21,26,R1F,ISLE OF WIGHT NHS TRUST,0.9835,2,0.8991,1.1086,0.8843,1.1308,865,880,4.9265,6.2763,59,3.8
FEB20_JAN21,JUN_21,26,RGP,JAMES PAGET UNIVERSITY HOSPITALS NHS FOUNDATION TRUST,1.0904,2,0.914,1.0915,0.8888,1.1251,1335,1225,6.0305,6.7239,34,2.8
FEB20_JAN21,JUN_21,26,RNQ,KETTERING GENERAL HOSPITAL NHS FOUNDATION TRUST,1.0924,2,0.9145,1.091,0.889,1.1249,1355,1240,5.0328,6.2729,44,2.4
FEB20_JAN21,JUN_21,26,RJZ,KING'S COLLEGE HOSPITAL NHS FOUNDATION TRUST,0.9721,2,0.9397,1.063,0.8951,1.1171,2460,2530,6.21,6.9322,51,2.4
FEB20_JAN21,JUN_21,26,RAX,KINGSTON HOSPITAL NHS FOUNDATION TRUST,0.7778,3,0.9121,1.0936,0.8883,1.1258,910,1170,4.4905,4.2805,41,1.1
FEB20_JAN21,JUN_21,26,RXN,LANCASHIRE TEACHING HOSPITALS NHS FOUNDATION TRUST,0.9331,2,0.9317,1.0717,0.8934,1.1193,1835,1965,6.7961,6.3326,51,2.4
FEB20_JAN21,JUN_21,26,RR8,LEEDS TEACHING HOSPITALS NHS TRUST,1.0649,2,0.9458,1.0563,0.8963,1.1156,3350,3150,4.9167,6.3815,30,1.9
FEB20_JAN21,JUN_21,26,RJ2,LEWISHAM AND GREENWICH NHS TRUST,0.9331,2,0.9329,1.0704,0.8937,1.119,1900,2035,3.5926,4.3722,31,1.2
FEB20_JAN21,JUN_21,26,REM,LIVERPOOL UNIVERSITY HOSPITALS NHS FOUNDATION TRUST,1.0589,2,0.945,1.0572,0.8962,1.1158,3235,3055,4.9614,5.5351,45,2.3
FEB20_JAN21,JUN_21,26,R1K,LONDON NORTH WEST UNIVERSITY HEALTHCARE NHS TRUST,0.8657,3,0.9371,1.0658,0.8946,1.1178,2010,2320,5.1226,5.0295,31,1.2
FEB20_JAN21,JUN_21,26,RWF,MAIDSTONE AND TUNBRIDGE WELLS NHS TRUST,0.9019,2,0.9375,1.0654,0.8947,1.1177,2120,2350,3.5776,5.3801,32,1.1
FEB20_JAN21,JUN_21,26,R0A,MANCHESTER UNIVERSITY NHS FOUNDATION TRUST,0.9271,2,0.9418,1.0607,0.8956,1.1166,2520,2715,5.9331,5.9467,47,2.9
FEB20_JAN21,JUN_21,26,RPA,MEDWAY NHS FOUNDATION TRUST,1.0471,2,0.9192,1.0856,0.8903,1.1233,1460,1390,5.1365,5.1006,39,1.7
FEB20_JAN21,JUN_21,26,RAJ,MID AND SOUTH ESSEX NHS FOUNDATION TRUST,1.052,2,0.956,1.0454,0.8981,1.1135,5045,4795,4.8579,5.1719,29,1.6
FEB20_JAN21,JUN_21,26,RBT,MID CHESHIRE HOSPITALS NHS FOUNDATION TRUST,0.9493,2,0.9143,1.0912,0.8889,1.125,1170,1235,5.5788,5.2799,26,1.3
FEB20_JAN21,JUN_21,26,RXF,MID YORKSHIRE HOSPITALS NHS TRUST,1.0939,2,0.9353,1.0677,0.8942,1.1183,2400,2195,5.3284,6.0531,29,1.5
FEB20_JAN21,JUN_21,26,RD8,MILTON KEYNES UNIVERSITY HOSPITAL NHS FOUNDATION TRUST,1.1259,2,0.9,1.1075,0.8846,1.1304,1010,900,4.8186,5.1856,54,2.8
FEB20_JAN21,JUN_21,26,RM1,NORFOLK AND NORWICH UNIVERSITY HOSPITALS NHS FOUNDATION TRUST,1.1939,1,0.9418,1.0607,0.8956,1.1166,3250,2720,4.9992,5.506,53,3.6
FEB20_JAN21,JUN_21,26,RVJ,NORTH BRISTOL NHS TRUST,0.9227,2,0.935,1.0681,0.8941,1.1184,2005,2175,5.8782,5.7316,39,1.5
FEB20_JAN21,JUN_21,26,RNN,NORTH CUMBRIA INTEGRATED CARE NHS FOUNDATION TRUST,1.0172,2,0.923,1.0814,0.8912,1.122,1560,1535,4.2955,5.5865,38,2.6
FEB20_JAN21,JUN_21,26,RAP,NORTH MIDDLESEX UNIVERSITY HOSPITAL NHS TRUST,0.9503,2,0.9096,1.0965,0.8875,1.1267,1050,1105,4.808,5.6807,32,1.7
FEB20_JAN21,JUN_21,26,RVW,NORTH TEES AND HARTLEPOOL NHS FOUNDATION TRUST,0.9971,2,0.9221,1.0824,0.891,1.1223,1495,1500,5.5135,6.9013,37,2.1
FEB20_JAN21,JUN_21,26,RGN,NORTH WEST ANGLIA NHS FOUNDATION TRUST,1.1289,1,0.9354,1.0677,0.8942,1.1183,2480,2200,3.7401,4.9279,35,2.3
FEB20_JAN21,JUN_21,26,RNS,NORTHAMPTON GENERAL HOSPITAL NHS TRUST,0.9852,2,0.9256,1.0785,0.8919,1.1212,1625,1650,3.7292,5.2096,41,1.4
FEB20_JAN21,JUN_21,26,RBZ,NORTHERN DEVON HEALTHCARE NHS TRUST,1.0455,2,0.8975,1.1104,0.8838,1.1315,890,850,3.2889,5.2847,28,1.4
FEB20_JAN21,JUN_21,26,RJL,NORTHERN LINCOLNSHIRE AND GOOLE NHS FOUNDATION TRUST,1.0565,2,0.9316,1.0719,0.8934,1.1194,2065,1955,5.128,6.4465,31,1.9
FEB20_JAN21,JUN_21,26,RTF,NORTHUMBRIA HEALTHCARE NHS FOUNDATION TRUST,0.9759,2,0.9419,1.0606,0.8956,1.1166,2660,2725,4.8663,5.4664,39,2.4
FEB20_JAN21,JUN_21,26,RX1,NOTTINGHAM UNIVERSITY HOSPITALS NHS TRUST,1.02,2,0.9487,1.0532,0.8969,1.115,3585,3515,7.513,7.1268,39,1.9
FEB20_JAN21,JUN_21,26,RTH,OXFORD UNIVERSITY HOSPITALS NHS FOUNDATION TRUST,0.9164,2,0.9449,1.0573,0.8962,1.1159,2785,3040,7.128,7.2767,55,2.6
FEB20_JAN21,JUN_21,26,RW6,PENNINE ACUTE HOSPITALS NHS TRUST,1.1168,1,0.9421,1.0603,0.8956,1.1165,3070,2750,5.3835,6.0401,33,1.7
FEB20_JAN21,JUN_21,26,RHU,PORTSMOUTH HOSPITALS UNIVERSITY NATIONAL HEALTH SERVICE TRUST,0.9656,2,0.9413,1.0612,0.8955,1.1167,2580,2675,5.8951,6.5553,39,1.8
FEB20_JAN21,JUN_21,26,RHW,ROYAL BERKSHIRE NHS FOUNDATION TRUST,1.008,2,0.9256,1.0785,0.8919,1.1212,1660,1645,3.2636,4.4673,51,2.2
FEB20_JAN21,JUN_21,26,REF,ROYAL CORNWALL HOSPITALS NHS TRUST,0.9881,2,0.9321,1.0713,0.8935,1.1192,1965,1990,4.717,5.2912,28,1.6
FEB20_JAN21,JUN_21,26,RH8,ROYAL DEVON AND EXETER NHS FOUNDATION TRUST,0.9753,2,0.932,1.0714,0.8934,1.1193,1930,1980,4.6838,5.4522,42,2.1
FEB20_JAN21,JUN_21,26,RAL,ROYAL FREE LONDON NHS FOUNDATION TRUST,0.8393,3,0.9389,1.0639,0.895,1.1174,2065,2460,6.3001,5.975,38,1.6
FEB20_JAN21,JUN_21,26,RA2,ROYAL SURREY COUNTY HOSPITAL NHS FOUNDATION TRUST,0.7876,3,0.9178,1.0872,0.8899,1.1237,1060,1345,7.0053,7.1766,62,2.9
FEB20_JAN21,JUN_21,26,RD1,ROYAL UNITED HOSPITALS BATH NHS FOUNDATION TRUST,1.0307,2,0.9244,1.0798,0.8916,1.1216,1645,1595,4.1275,5.3703,31,1.5
FEB20_JAN21,JUN_21,26,RM3,SALFORD ROYAL NHS FOUNDATION TRUST,0.9616,2,0.9228,1.0816,0.8912,1.1221,1470,1530,7.3026,7.4791,55,4
FEB20_JAN21,JUN_21,26,RNZ,SALISBURY NHS FOUNDATION TRUST,1.0274,2,0.9002,1.1073,0.8847,1.1304,925,900,4.7851,4.7023,50,2.3
FEB20_JAN21,JUN_21,26,RXK,SANDWELL AND WEST BIRMINGHAM HOSPITALS NHS TRUST,1.1504,1,0.9212,1.0834,0.8908,1.1226,1685,1465,4.9797,6.131,22,1
FEB20_JAN21,JUN_21,26,RHQ,SHEFFIELD TEACHING HOSPITALS NHS FOUNDATION TRUST,0.9885,2,0.9428,1.0596,0.8958,1.1164,2790,2820,6.2417,5.7557,33,1.8
FEB20_JAN21,JUN_21,26,RK5,SHERWOOD FOREST HOSPITALS NHS FOUNDATION TRUST,0.9778,2,0.9279,1.0759,0.8925,1.1205,1720,1760,5.5856,6.2726,10,0.6
FEB20_JAN21,JUN_21,26,RH5,SOMERSET NHS FOUNDATION TRUST,0.9981,2,0.9299,1.0737,0.893,1.1199,1855,1860,5.0134,6.0678,19,1.4
FEB20_JAN21,JUN_21,26,RTR,SOUTH TEES HOSPITALS NHS FOUNDATION TRUST,1.1568,1,0.9304,1.0731,0.8931,1.1197,2185,1890,4.8642,5.2712,48,2.5
FEB20_JAN21,JUN_21,26,R0B,SOUTH TYNESIDE AND SUNDERLAND NHS FOUNDATION TRUST,1.1245,1,0.938,1.0648,0.8948,1.1176,2695,2395,4.8218,6.549,29,2.3
FEB20_JAN21,JUN_21,26,RJC,SOUTH WARWICKSHIRE NHS FOUNDATION TRUST,0.9717,2,0.9087,1.0975,0.8873,1.127,1050,1085,4.464,5.6789,31,1.5
FEB20_JAN21,JUN_21,26,RVY,SOUTHPORT AND ORMSKIRK HOSPITAL NHS TRUST,1.0324,2,0.906,1.1006,0.8865,1.1281,1050,1020,4.7046,5.507,49,3.3
FEB20_JAN21,JUN_21,26,RJ7,ST GEORGE'S UNIVERSITY HOSPITALS NHS FOUNDATION TRUST,0.8333,3,0.9279,1.0759,0.8925,1.1205,1465,1760,5.8045,6.4801,50,2
FEB20_JAN21,JUN_21,26,RBN,ST HELENS AND KNOWSLEY TEACHING HOSPITALS NHS TRUST,1.1161,2,0.9297,1.074,0.8929,1.1199,2065,1850,5.3061,5.188,38,1.8
FEB20_JAN21,JUN_21,26,RWJ,STOCKPORT NHS FOUNDATION TRUST,0.9727,2,0.9196,1.0852,0.8904,1.1231,1365,1405,3.9542,5.1928,23,1.1
FEB20_JAN21,JUN_21,26,RTP,SURREY AND SUSSEX HEALTHCARE NHS TRUST,0.9354,2,0.9259,1.0782,0.892,1.1211,1555,1660,6.2609,7.643,47,2.6
FEB20_JAN21,JUN_21,26,RMP,TAMESIDE AND GLOSSOP INTEGRATED CARE NHS FOUNDATION TRUST,1.1011,2,0.903,1.1041,0.8855,1.1293,1050,955,6.0513,5.9021,20,1
FEB20_JAN21,JUN_21,26,RNA,THE DUDLEY GROUP NHS FOUNDATION TRUST,1.1783,1,0.9282,1.0756,0.8926,1.1204,2090,1775,5.1643,5.7536,23,1.5
FEB20_JAN21,JUN_21,26,RAS,THE HILLINGDON HOSPITALS NHS FOUNDATION TRUST,1.0234,2,0.8923,1.1164,0.8821,1.1337,790,770,3.4401,3.6206,44,2.1
FEB20_JAN21,JUN_21,26,RTD,THE NEWCASTLE UPON TYNE HOSPITALS NHS FOUNDATION TRUST,0.9527,2,0.936,1.067,0.8943,1.1181,2135,2240,6.0428,5.6829,40,1.9
FEB20_JAN21,JUN_21,26,RQW,THE PRINCESS ALEXANDRA HOSPITAL NHS TRUST,1.0387,2,0.9062,1.1004,0.8865,1.128,1065,1025,4.5883,4.7979,30,1.1
FEB20_JAN21,JUN_21,26,RCX,"THE QUEEN ELIZABETH HOSPITAL, KING'S LYNN, NHS FOUNDATION TRUST",1.0456,2,0.9176,1.0874,0.8898,1.1238,1400,1335,4.2431,4.6686,7,0.5
FEB20_JAN21,JUN_21,26,RFR,THE ROTHERHAM NHS FOUNDATION TRUST,1.1077,2,0.9085,1.0977,0.8872,1.1271,1195,1080,6.2985,6.2644,25,1.2
FEB20_JAN21,JUN_21,26,RL4,THE ROYAL WOLVERHAMPTON NHS TRUST,1.0135,2,0.934,1.0692,0.8939,1.1187,2135,2105,8.1038,7.0978,32,2.1
FEB20_JAN21,JUN_21,26,RXW,THE SHREWSBURY AND TELFORD HOSPITAL NHS TRUST,1.0787,2,0.9346,1.0685,0.8941,1.1185,2315,2150,5.6479,6.5285,31,2.1
FEB20_JAN21,JUN_21,26,RA9,TORBAY AND SOUTH DEVON NHS FOUNDATION TRUST,1.0053,2,0.9221,1.0824,0.891,1.1223,1505,1500,5.3364,5.1421,31,1.8
FEB20_JAN21,JUN_21,26,RWD,UNITED LINCOLNSHIRE HOSPITALS NHS TRUST,1.1205,1,0.9412,1.0613,0.8955,1.1168,2990,2670,4.9795,6.5591,23,1.6
FEB20_JAN21,JUN_21,26,RRV,UNIVERSITY COLLEGE LONDON HOSPITALS NHS FOUNDATION TRUST,0.7338,3,0.917,1.0881,0.8897,1.124,965,1320,6.1323,6.6729,39,1.3
FEB20_JAN21,JUN_21,26,RHM,UNIVERSITY HOSPITAL SOUTHAMPTON NHS FOUNDATION TRUST,0.8261,3,0.9426,1.0598,0.8957,1.1164,2315,2800,6.501,8.47,41,2.3
FEB20_JAN21,JUN_21,26,RRK,UNIVERSITY HOSPITALS BIRMINGHAM NHS FOUNDATION TRUST,0.9581,2,0.9604,1.0407,0.8987,1.1127,5710,5960,5.0908,7.098,28,1.5
FEB20_JAN21,JUN_21,26,RA7,UNIVERSITY HOSPITALS BRISTOL AND WESTON NHS FOUNDATION TRUST,0.9363,2,0.9354,1.0677,0.8942,1.1183,2060,2200,5.2092,5.6563,33,1.6
FEB20_JAN21,JUN_21,26,RKB,UNIVERSITY HOSPITALS COVENTRY AND WARWICKSHIRE NHS TRUST,1.0819,2,0.9371,1.0658,0.8946,1.1178,2515,2325,4.309,4.354,32,1.4
FEB20_JAN21,JUN_21,26,R0D,UNIVERSITY HOSPITALS DORSET NHS FOUNDATION TRUST,0.9077,2,0.9487,1.0532,0.8969,1.115,3195,3520,4.1824,5.717,38,2.4
FEB20_JAN21,JUN_21,26,RTG,UNIVERSITY HOSPITALS OF DERBY AND BURTON NHS FOUNDATION TRUST,0.9024,2,0.9514,1.0503,0.8973,1.1144,3535,3920,5.5638,6.0943,30,1.6
FEB20_JAN21,JUN_21,26,RWE,UNIVERSITY HOSPITALS OF LEICESTER NHS TRUST,1.0359,2,0.9489,1.053,0.8969,1.1149,3665,3540,5.4929,5.2311,34,1.8
FEB20_JAN21,JUN_21,26,RTX,UNIVERSITY HOSPITALS OF MORECAMBE BAY NHS FOUNDATION TRUST,1.032,2,0.9226,1.0819,0.8911,1.1222,1565,1520,6.8506,6.7007,33,2
FEB20_JAN21,JUN_21,26,RJE,UNIVERSITY HOSPITALS OF NORTH MIDLANDS NHS TRUST,1.0345,2,0.948,1.054,0.8967,1.1151,3535,3420,6.8293,6.1679,47,2.3
FEB20_JAN21,JUN_21,26,RK9,UNIVERSITY HOSPITALS PLYMOUTH NHS TRUST,1.1386,1,0.9324,1.071,0.8935,1.1191,2285,2005,5.2751,4.9533,24,1.6
FEB20_JAN21,JUN_21,26,RYR,UNIVERSITY HOSPITALS SUSSEX NHS FOUNDATION TRUST,1.0327,2,0.9542,1.0473,0.8978,1.1138,4580,4435,4.5981,5.9858,44,2.6
FEB20_JAN21,JUN_21,26,RBK,WALSALL HEALTHCARE NHS TRUST,1.0997,2,0.913,1.0926,0.8885,1.1254,1315,1195,5.5661,5.3475,29,1.3
FEB20_JAN21,JUN_21,26,RWW,WARRINGTON AND HALTON TEACHING HOSPITALS NHS FOUNDATION TRUST,1.0407,2,0.9065,1.1001,0.8866,1.1279,1070,1030,7.6258,7.3352,50,2.4
FEB20_JAN21,JUN_21,26,RWG,WEST HERTFORDSHIRE HOSPITALS NHS TRUST,0.9954,2,0.9257,1.0784,0.8919,1.1212,1645,1650,5.1579,5.6873,40,1.9
FEB20_JAN21,JUN_21,26,RGR,WEST SUFFOLK NHS FOUNDATION TRUST,0.9116,2,0.9202,1.0845,0.8905,1.1229,1300,1430,4.9043,7.1293,46,2.8
FEB20_JAN21,JUN_21,26,RKE,WHITTINGTON HEALTH NHS TRUST,0.8723,3,0.869,1.1442,0.8736,1.1446,445,510,3.7771,5.5639,47,2.2
FEB20_JAN21,JUN_21,26,RBL,WIRRAL UNIVERSITY TEACHING HOSPITAL NHS FOUNDATION TRUST,1.0748,2,0.9256,1.0785,0.8919,1.1212,1770,1650,5.2306,6.3468,51,2.7
FEB20_JAN21,JUN_21,26,RWP,WORCESTERSHIRE ACUTE HOSPITALS NHS TRUST,1.021,2,0.9385,1.0642,0.8949,1.1175,2485,2435,5.2085,6.7761,35,2.2
FEB20_JAN21,JUN_21,26,RRF,"WRIGHTINGTON, WIGAN AND LEIGH NHS FOUNDATION TRUST",1.1153,2,0.9133,1.0923,0.8886,1.1254,1340,1205,5.7421,6.5051,40,2.4
FEB20_JAN21,JUN_21,26,RLQ,WYE VALLEY NHS TRUST,1.0177,2,0.9041,1.1028,0.8859,1.1288,995,980,4.649,5.8764,32,2.1
FEB20_JAN21,JUN_21,26,RA4,YEOVIL DISTRICT HOSPITAL NHS FOUNDATION TRUST,0.9007,2,0.9059,1.1007,0.8865,1.1281,915,1020,3.9582,5.7145,57,3.3
FEB20_JAN21,JUN_21,26,RCB,YORK TEACHING HOSPITAL NHS FOUNDATION TRUST,0.9456,2,0.9413,1.0612,0.8955,1.1167,2530,2680,4.3543,5.3144,24,1.3
MAR20_FEB21,JUL_21,27,RCF,AIREDALE NHS FOUNDATION TRUST,0.933,2,0.8965,1.1116,0.8823,1.1334,780,835,4.4782,4.6632,15,0.9
MAR20_FEB21,JUL_21,27,RTK,ASHFORD AND ST PETER'S HOSPITALS NHS FOUNDATION TRUST,0.9572,2,0.9186,1.0863,0.8889,1.125,1315,1370,4.4982,6.1726,40,2.1
MAR20_FEB21,JUL_21,27,RF4,"BARKING, HAVERING AND REDBRIDGE UNIVERSITY HOSPITALS NHS TRUST",0.9772,2,0.9339,1.0693,0.8926,1.1203,2050,2100,5.8397,6.6492,38,2
MAR20_FEB21,JUL_21,27,RFF,BARNSLEY HOSPITAL NHS FOUNDATION TRUST,1.0557,2,0.9119,1.0939,0.887,1.1274,1230,1165,5.6428,7.1418,24,1.8
MAR20_FEB21,JUL_21,27,R1H,BARTS HEALTH NHS TRUST,0.9561,2,0.9438,1.0585,0.8946,1.1178,2790,2920,8.1713,6.6377,34,1.3
MAR20_FEB21,JUL_21,27,RC9,BEDFORDSHIRE HOSPITALS NHS FOUNDATION TRUST,1.041,2,0.9337,1.0696,0.8925,1.1204,2170,2085,5.3849,5.3712,36,1.4
MAR20_FEB21,JUL_21,27,RXL,BLACKPOOL TEACHING HOSPITALS NHS FOUNDATION TRUST,1.0469,2,0.9248,1.0794,0.8904,1.123,1685,1610,7.3692,7.9024,31,1.8
MAR20_FEB21,JUL_21,27,RMC,BOLTON NHS FOUNDATION TRUST,1.1179,2,0.9095,1.0966,0.8863,1.1283,1230,1100,4.9848,4.8553,30,1.3
MAR20_FEB21,JUL_21,27,RAE,BRADFORD TEACHING HOSPITALS NHS FOUNDATION TRUST,1.0284,2,0.9183,1.0867,0.8888,1.1252,1400,1360,4.8406,4.6464,25,0.9
MAR20_FEB21,JUL_21,27,RXQ,BUCKINGHAMSHIRE HEALTHCARE NHS TRUST,1.0535,2,0.9174,1.0877,0.8885,1.1255,1400,1330,4.8557,3.9922,53,2.4
MAR20_FEB21,JUL_21,27,RWY,CALDERDALE AND HUDDERSFIELD NHS FOUNDATION TRUST,1.0277,2,0.9314,1.072,0.892,1.121,2000,1950,5.554,6.3635,35,2.1
MAR20_FEB21,JUL_21,27,RGT,CAMBRIDGE UNIVERSITY HOSPITALS NHS FOUNDATION TRUST,0.8907,3,0.9349,1.0682,0.8928,1.1201,1925,2165,3.9849,6.5086,45,2.6
MAR20_FEB21,JUL_21,27,RQM,CHELSEA AND WESTMINSTER HOSPITAL NHS FOUNDATION TRUST,0.7579,3,0.9242,1.08,0.8903,1.1232,1205,1585,3.7561,5.6231,54,1.7
MAR20_FEB21,JUL_21,27,RFS,CHESTERFIELD ROYAL HOSPITAL NHS FOUNDATION TRUST,0.9511,2,0.9216,1.0829,0.8896,1.1241,1410,1480,4.8429,6.3036,26,1.4
MAR20_FEB21,JUL_21,27,RJR,COUNTESS OF CHESTER HOSPITAL NHS FOUNDATION TRUST,1.0704,2,0.9058,1.1008,0.8852,1.1297,1085,1015,3.8878,4.252,25,1.1
MAR20_FEB21,JUL_21,27,RXP,COUNTY DURHAM AND DARLINGTON NHS FOUNDATION TRUST,1.1705,1,0.9347,1.0684,0.8928,1.1201,2520,2150,5.5418,5.5752,53,3.6
MAR20_FEB21,JUL_21,27,RJ6,CROYDON HEALTH SERVICES NHS TRUST,1.0261,2,0.8994,1.1082,0.8833,1.1322,910,885,3.6826,5.8085,51,2.8
MAR20_FEB21,JUL_21,27,RN7,DARTFORD AND GRAVESHAM NHS TRUST,1.0132,2,0.9077,1.0987,0.8858,1.1289,1070,1060,2.7058,3.7408,43,1.4
MAR20_FEB21,JUL_21,27,RP5,DONCASTER AND BASSETLAW TEACHING HOSPITALS NHS FOUNDATION TRUST,1.1021,2,0.93,1.0736,0.8917,1.1214,2060,1865,4.5446,5.6725,44,2.3
MAR20_FEB21,JUL_21,27,RBD,DORSET COUNTY HOSPITAL NHS FOUNDATION TRUST,1.1379,1,0.8997,1.1079,0.8833,1.1321,1015,890,5.2769,6.1833,44,3.1
MAR20_FEB21,JUL_21,27,RWH,EAST AND NORTH HERTFORDSHIRE NHS TRUST,0.8728,3,0.933,1.0703,0.8924,1.1206,1785,2045,4.3465,5.6526,34,1.8
MAR20_FEB21,JUL_21,27,RJN,EAST CHESHIRE NHS TRUST,0.9797,2,0.8807,1.1301,0.8769,1.1404,610,625,5.8794,7.1305,22,1.9
MAR20_FEB21,JUL_21,27,RVV,EAST KENT HOSPITALS UNIVERSITY NHS FOUNDATION TRUST,1.0413,2,0.942,1.0605,0.8943,1.1182,2850,2740,4.7132,5.6856,37,1.9
MAR20_FEB21,JUL_21,27,RXR,EAST LANCASHIRE HOSPITALS NHS TRUST,1.083,2,0.9316,1.0718,0.8921,1.121,2120,1960,5.4078,5.2095,31,1.6
MAR20_FEB21,JUL_21,27,RDE,EAST SUFFOLK AND NORTH ESSEX NHS FOUNDATION TRUST,1.074,2,0.9461,1.056,0.8951,1.1172,3420,3185,5.5192,6.3063,31,2.1
MAR20_FEB21,JUL_21,27,RXC,EAST SUSSEX HEALTHCARE NHS TRUST,0.9559,2,0.9348,1.0683,0.8928,1.1201,2065,2160,6.0453,7.0634,40,2.4
MAR20_FEB21,JUL_21,27,RVR,EPSOM AND ST HELIER UNIVERSITY HOSPITALS NHS TRUST,0.9628,2,0.9198,1.085,0.8892,1.1246,1360,1415,5.626,6.228,40,2
MAR20_FEB21,JUL_21,27,RDU,FRIMLEY HEALTH NHS FOUNDATION TRUST,0.9636,2,0.9428,1.0596,0.8944,1.118,2715,2815,4.2041,5.2721,42,2.2
MAR20_FEB21,JUL_21,27,RR7,GATESHEAD HEALTH NHS FOUNDATION TRUST,1.0038,2,0.9123,1.0935,0.8871,1.1273,1180,1175,5.5235,7.0962,39,2.6
MAR20_FEB21,JUL_21,27,RLT,GEORGE ELIOT HOSPITAL NHS TRUST,1.0097,2,0.8958,1.1124,0.8821,1.1337,830,825,4.144,5.6056,32,1.9
MAR20_FEB21,JUL_21,27,RTE,GLOUCESTERSHIRE HOSPITALS NHS FOUNDATION TRUST,0.9789,2,0.9395,1.0632,0.8938,1.1188,2460,2515,4.8101,4.9856,35,1.7
MAR20_FEB21,JUL_21,27,RN3,GREAT WESTERN HOSPITALS NHS FOUNDATION TRUST,0.9535,2,0.9243,1.0799,0.8903,1.1232,1520,1590,4.7157,4.8902,35,2.1
MAR20_FEB21,JUL_21,27,RJ1,GUY'S AND ST THOMAS' NHS FOUNDATION TRUST,0.7214,3,0.9228,1.0816,0.8899,1.1237,1100,1525,6.1937,6.6149,57,1.9
MAR20_FEB21,JUL_21,27,RN5,HAMPSHIRE HOSPITALS NHS FOUNDATION TRUST,0.9747,2,0.9302,1.0734,0.8918,1.1214,1830,1880,3.5205,5.4005,45,2.6
MAR20_FEB21,JUL_21,27,RCD,HARROGATE AND DISTRICT NHS FOUNDATION TRUST,0.9445,2,0.8903,1.1188,0.8803,1.136,700,740,3.7582,4.8052,27,1.4
MAR20_FEB21,JUL_21,27,RQX,HOMERTON UNIVERSITY HOSPITAL NHS FOUNDATION TRUST,0.8739,2,0.8707,1.1421,0.8732,1.1452,460,525,6.6251,6.9183,43,1
MAR20_FEB21,JUL_21,27,RWA,HULL UNIVERSITY TEACHING HOSPITALS NHS TRUST,1.1459,1,0.9378,1.065,0.8934,1.1193,2725,2380,7.3907,6.5788,31,2.5
MAR20_FEB21,JUL_21,27,RYJ,IMPERIAL COLLEGE HEALTHCARE NHS TRUST,0.7724,3,0.9351,1.068,0.8929,1.12,1680,2175,7.5519,7.3776,57,2.5
MAR20_FEB21,JUL_21,27,R1F,ISLE OF WIGHT NHS TRUST,0.9964,2,0.898,1.1098,0.8828,1.1327,860,860,4.977,6.3977,59,3.9
MAR20_FEB21,JUL_21,27,RGP,JAMES PAGET UNIVERSITY HOSPITALS NHS FOUNDATION TRUST,1.1019,2,0.9125,1.0932,0.8872,1.1272,1305,1180,6.2619,6.8083,34,2.8
MAR20_FEB21,JUL_21,27,RNQ,KETTERING GENERAL HOSPITAL NHS FOUNDATION TRUST,1.1123,2,0.9127,1.093,0.8872,1.1271,1320,1185,4.8717,6.2864,44,2.4
MAR20_FEB21,JUL_21,27,RJZ,KING'S COLLEGE HOSPITAL NHS FOUNDATION TRUST,0.969,2,0.9388,1.0639,0.8937,1.119,2380,2460,6.2729,6.9982,50,2.3
MAR20_FEB21,JUL_21,27,RAX,KINGSTON HOSPITAL NHS FOUNDATION TRUST,0.7752,3,0.9098,1.0962,0.8864,1.1281,860,1110,4.4624,4.2746,39,1
MAR20_FEB21,JUL_21,27,RXN,LANCASHIRE TEACHING HOSPITALS NHS FOUNDATION TRUST,0.9304,2,0.9306,1.0729,0.8919,1.1213,1770,1900,6.793,6.3514,50,2.3
MAR20_FEB21,JUL_21,27,RR8,LEEDS TEACHING HOSPITALS NHS TRUST,1.0697,2,0.9453,1.0569,0.8949,1.1174,3300,3085,5.032,6.5188,30,1.9
MAR20_FEB21,JUL_21,27,RJ2,LEWISHAM AND GREENWICH NHS TRUST,0.9246,2,0.9317,1.0717,0.8921,1.121,1815,1965,3.6027,4.3574,31,1.2
MAR20_FEB21,JUL_21,27,REM,LIVERPOOL UNIVERSITY HOSPITALS NHS FOUNDATION TRUST,1.0498,2,0.9442,1.0581,0.8947,1.1177,3110,2965,5.0176,5.6046,45,2.3
MAR20_FEB21,JUL_21,27,R1K,LONDON NORTH WEST UNIVERSITY HEALTHCARE NHS TRUST,0.8654,3,0.9357,1.0673,0.893,1.1198,1925,2225,5.0207,5.0628,29,1.2
MAR20_FEB21,JUL_21,27,RWF,MAIDSTONE AND TUNBRIDGE WELLS NHS TRUST,0.8979,2,0.937,1.0659,0.8933,1.1195,2080,2315,3.5635,5.8128,31,1
MAR20_FEB21,JUL_21,27,R0A,MANCHESTER UNIVERSITY NHS FOUNDATION TRUST,0.9108,2,0.9412,1.0613,0.8941,1.1184,2430,2665,6.0468,6.0862,46,2.9
MAR20_FEB21,JUL_21,27,RPA,MEDWAY NHS FOUNDATION TRUST,1.0542,2,0.9175,1.0876,0.8886,1.1254,1405,1335,5.1222,5.1685,38,1.6
MAR20_FEB21,JUL_21,27,RAJ,MID AND SOUTH ESSEX NHS FOUNDATION TRUST,1.1242,1,0.9546,1.0469,0.8965,1.1154,5070,4510,4.1774,4.6714,29,1.6
MAR20_FEB21,JUL_21,27,RBT,MID CHESHIRE HOSPITALS NHS FOUNDATION TRUST,0.9311,2,0.9151,1.0903,0.8879,1.1263,1170,1255,5.7481,5.2966,27,1.3
MAR20_FEB21,JUL_21,27,RXF,MID YORKSHIRE HOSPITALS NHS TRUST,1.0889,2,0.9341,1.0691,0.8926,1.1203,2300,2115,5.4007,6.1986,30,1.6
MAR20_FEB21,JUL_21,27,RD8,MILTON KEYNES UNIVERSITY HOSPITAL NHS FOUNDATION TRUST,1.1025,2,0.8985,1.1093,0.883,1.1326,960,870,4.8997,5.2236,54,2.8
MAR20_FEB21,JUL_21,27,RM1,NORFOLK AND NORWICH UNIVERSITY HOSPITALS NHS FOUNDATION TRUST,1.203,1,0.941,1.0615,0.8941,1.1184,3185,2645,5.0425,5.5643,53,3.6
MAR20_FEB21,JUL_21,27,RVJ,NORTH BRISTOL NHS TRUST,0.9177,2,0.9343,1.0688,0.8927,1.1202,1950,2125,5.9117,5.7738,39,1.5
MAR20_FEB21,JUL_21,27,RNN,NORTH CUMBRIA INTEGRATED CARE NHS FOUNDATION TRUST,1.0568,2,0.9176,1.0875,0.8886,1.1254,1410,1335,4.3684,5.6266,39,2.7
MAR20_FEB21,JUL_21,27,RAP,NORTH MIDDLESEX UNIVERSITY HOSPITAL NHS TRUST,0.962,2,0.9076,1.0987,0.8858,1.129,1015,1055,4.8341,5.749,33,1.8
MAR20_FEB21,JUL_21,27,RVW,NORTH TEES AND HARTLEPOOL NHS FOUNDATION TRUST,0.993,2,0.9209,1.0838,0.8894,1.1243,1440,1450,5.5445,7.0598,36,2.1
MAR20_FEB21,JUL_21,27,RGN,NORTH WEST ANGLIA NHS FOUNDATION TRUST,1.1295,1,0.9344,1.0687,0.8927,1.1202,2410,2135,3.8055,5.0108,35,2.3
MAR20_FEB21,JUL_21,27,RNS,NORTHAMPTON GENERAL HOSPITAL NHS TRUST,0.9827,2,0.9249,1.0792,0.8905,1.123,1590,1620,3.7886,5.2871,41,1.4
MAR20_FEB21,JUL_21,27,RBZ,NORTHERN DEVON HEALTHCARE NHS TRUST,1.0615,2,0.8971,1.1109,0.8825,1.1331,900,845,3.3217,5.4014,29,1.5
MAR20_FEB21,JUL_21,27,RJL,NORTHERN LINCOLNSHIRE AND GOOLE NHS FOUNDATION TRUST,1.0546,2,0.9311,1.0724,0.892,1.1211,2030,1925,5.1228,6.5073,31,1.9
MAR20_FEB21,JUL_21,27,RTF,NORTHUMBRIA HEALTHCARE NHS FOUNDATION TRUST,0.9726,2,0.9411,1.0614,0.8941,1.1184,2585,2660,4.8482,5.505,40,2.4
MAR20_FEB21,JUL_21,27,RX1,NOTTINGHAM UNIVERSITY HOSPITALS NHS TRUST,1.0096,2,0.9481,1.0539,0.8954,1.1168,3465,3430,7.5742,7.19,40,1.9
MAR20_FEB21,JUL_21,27,RTH,OXFORD UNIVERSITY HOSPITALS NHS FOUNDATION TRUST,0.9189,2,0.9445,1.0577,0.8948,1.1176,2755,3000,7.2757,7.4046,54,2.6
MAR20_FEB21,JUL_21,27,RW6,PENNINE ACUTE HOSPITALS NHS TRUST,1.1275,1,0.9413,1.0612,0.8942,1.1184,3015,2675,5.3976,6.0724,33,1.7
MAR20_FEB21,JUL_21,27,RHU,PORTSMOUTH HOSPITALS UNIVERSITY NATIONAL HEALTH SERVICE TRUST,0.9581,2,0.9405,1.0621,0.894,1.1186,2490,2600,5.9143,6.6099,38,1.8
MAR20_FEB21,JUL_21,27,RHW,ROYAL BERKSHIRE NHS FOUNDATION TRUST,1.0204,2,0.9248,1.0793,0.8905,1.123,1645,1615,3.3315,4.5167,51,2.3
MAR20_FEB21,JUL_21,27,REF,ROYAL CORNWALL HOSPITALS NHS TRUST,0.9874,2,0.9316,1.0719,0.8921,1.121,1930,1955,4.6946,5.3364,27,1.8
MAR20_FEB21,JUL_21,27,RH8,ROYAL DEVON AND EXETER NHS FOUNDATION TRUST,0.9611,2,0.9318,1.0716,0.8921,1.1209,1895,1970,4.8373,5.841,43,2.2
MAR20_FEB21,JUL_21,27,RAL,ROYAL FREE LONDON NHS FOUNDATION TRUST,0.8302,3,0.9377,1.0651,0.8934,1.1193,1970,2370,6.288,6.0026,38,1.6
MAR20_FEB21,JUL_21,27,RA2,ROYAL SURREY COUNTY HOSPITAL NHS FOUNDATION TRUST,0.7778,3,0.9162,1.089,0.8882,1.1259,1005,1290,7.0367,7.2754,62,2.9
MAR20_FEB21,JUL_21,27,RD1,ROYAL UNITED HOSPITALS BATH NHS FOUNDATION TRUST,1.0368,2,0.9231,1.0812,0.89,1.1236,1600,1540,4.0454,5.451,32,1.5
MAR20_FEB21,JUL_21,27,RM3,SALFORD ROYAL NHS FOUNDATION TRUST,0.9608,2,0.9222,1.0823,0.8898,1.1239,1445,1505,7.438,7.5618,54,3.8
MAR20_FEB21,JUL_21,27,RNZ,SALISBURY NHS FOUNDATION TRUST,1.0097,2,0.8986,1.1091,0.883,1.1325,880,875,4.9273,4.7269,51,2.3
MAR20_FEB21,JUL_21,27,RXK,SANDWELL AND WEST BIRMINGHAM HOSPITALS NHS TRUST,1.1602,1,0.919,1.0858,0.889,1.1249,1605,1385,5.0988,6.2276,23,1.1
MAR20_FEB21,JUL_21,27,RHQ,SHEFFIELD TEACHING HOSPITALS NHS FOUNDATION TRUST,0.9949,2,0.9421,1.0604,0.8943,1.1182,2735,2750,6.2886,5.7804,34,1.8
MAR20_FEB21,JUL_21,27,RK5,SHERWOOD FOREST HOSPITALS NHS FOUNDATION TRUST,0.9756,2,0.9268,1.0771,0.8909,1.1224,1665,1705,5.6055,6.2666,10,0.6
MAR20_FEB21,JUL_21,27,RH5,SOMERSET NHS FOUNDATION TRUST,0.9879,2,0.929,1.0747,0.8915,1.1217,1790,1815,5.1285,6.1478,19,1.4
MAR20_FEB21,JUL_21,27,RTR,SOUTH TEES HOSPITALS NHS FOUNDATION TRUST,1.1638,1,0.9295,1.0742,0.8916,1.1216,2140,1840,4.8938,5.327,48,2.5
MAR20_FEB21,JUL_21,27,R0B,SOUTH TYNESIDE AND SUNDERLAND NHS FOUNDATION TRUST,1.1186,2,0.937,1.0659,0.8933,1.1195,2585,2315,4.9131,6.6677,29,2.3
MAR20_FEB21,JUL_21,27,RJC,SOUTH WARWICKSHIRE NHS FOUNDATION TRUST,0.9646,2,0.9079,1.0984,0.8858,1.1289,1025,1065,4.4373,5.7231,31,1.4
